Review,Positive,Negative,Neutral,Compound,Sentiment
I got mixed and akne prone skinI got this product specifically for the no akne parti got pimples not a lot but more than beforewith othersAlso the smell was really bad and the cream was heavy and oilyI looked like I bathed my face in oil or like my brother said he could see himself on my forehead,0.101,0.106,0.793,-0.0745,Negative
I have the worst face skin Its oily red full of filaments and small pimples As soon as the sun hits my face I turn into a crab a painful one Im also a guy if thats relevantThis cream has been better for me than any other cream in my 20 years of life so far It doesnt clog any pores its easy too remove if your want to with water and a bit of soap its doesnt smell and it has NO ALCOHOL so it doesnt dry your skinI live in Europe and this is the second batch I buy of itAnd no even though you shouldnt use sun screen thats older than some months I can guarantee that after more than one year it still is very effective at blocking the sun My face can feel a huge difference at the end of the day compared to not using any cream Im pretty sure it also has some kind of moisturizing effect because for a few hours after I apply it if I stay kiiinda protected from the sun my face feels much lighter and radiant,0.13,0.074,0.796,0.8518,Positive
Wanted a facial sunscreen for a summer holiday that would help with my problem skin I have spot prone skin and the standard beach break combination of sun lotion and sweat makes me break out terribly so that every time i come back from holiday i look worse than when I went Ordered this and was surprised at how quickly it came given that it was shipped from the US Was pretty pleased with this Had a small breakout but nowhere near what I usually get from when I have tried both a standard suncream and also spent a lot of money on a suncream from a very reputable skincaremakeup company This may have also been because i sometimes mixed it with my body sun lotion so it was definitely the best option Ive tried so far Once applied it stayed matte on my generally oily face which i was impressed at No thick oily residue that lasts for ages and makes skin shiny For this reason I actually was able to test this out under makeup before my holiday without a problem at all as it is more matte than many daily moisturizers Ive had Rubbed in well Occasionally after repeated application it had a quite a tingly feeling but i would liken this to the feeling you get applying a spot cream My only concern is that as a US product there is no indication of UVA and UVB ratings that UK products give you hence why I mixed it occasionally with my body suncream Even so I would definitely recommend this and will buy again particularly as it sits so well under makeup that i will happily use it all year round,0.167,0.051,0.782,0.9875,Positive
Packaging came nicely packaged and not faulty in any way The tube has a matte feel which is convenient when having sunscreen covered fingers as it prevents it from slipping out of your handsIngredients compared to other sunscreens I found no major harmful ingredients in this product and a handful of benefits aside to the obvious uv protection You can use an online cosmetic analyser to see more info on thisHowever this sunscreen does leave a white cast behind To counter this I can kind of blend it in if I dont use too much  but then again Im white so if you are someone with dark black or brown skin you may want to avoid this and look towards a sunscreen in a gel form or liquid spray,0.062,0.044,0.894,0.0852,Positive
Ive probably tried about 20 different sunscreens in the past two years Chemical physical combo highend drugstore asian european american  you name it Ive probably tried it Every single one broke me out somehow Ive tried to figure out what ingredient breaks me out but with no success I bought this with a pinch of salt I found it strange they can almost guarantee it wont break you out Ive tried the ultra sheer dry touch which didnt break me out but stung so badly around my eyes This one doesnt contain as much fragrance and doesnt sting at all This one doesnt break me out at all Im not sure how they do it but it just feels like moisturiser It will be a sad day when they stop producing this as its the only sunscreen Ill use from now on Its slightly shiny but I just apply a matte powder on top and Im ready to go about my day Absolutely exceptional Nuetrogena It also has HELIOPLEX technology meaning it wont degrade in the sun like other chemical sunscreens would needing to be reapplied every two hours,0.103,0.118,0.779,-0.5123,Negative
I used to like it until warmer weather arrived The warmer days meant the product moved around the face getting into eyes which did not happen during colder months when it stayed put It stung my eyes so bad especially at the end of the day as if I was cutting onions literally watering eyes And the stinging stayed long after washing vigorously with makeup removerAlso having done a bit of research into chemical sunscreen I discovered that it was contributing to my dermatitis Now using 100 percent mineral based sunscreen ONLY,0.087,0.062,0.851,0.105,Positive
Seems to work well in protecting against sun damage and preventing skin outbreaks Does feel light and thin but very oily at the same time and leaves a noticeable white cast that requires a lot of work to rub in Not sure if it would be suitable for darker skin tones since I am paler but the white cast could be an issue if youre not pale,0.023,0.083,0.894,-0.4666,Negative
I bought this for a specific reason I needed a suncream that would go in hand luggage and it must not cause heat rash Up until now the only one I could find that didnt bring me out it horrendous rash was Clinique spray too big for hand luggage and rather pricey Im happy to report that its so far so good with thisIf you have to use oil free suncream youll be used to having to reapply regularly particularly around where clothing or bag straps might rub away from skin and its no different with this but when I applied properly I didnt burn and most importantly no heat rash This is such a big deal for me Im giving this 5 stars for this fact alone If youre lucky enough to be able to use oil based suncreams then I expect you will find this substandard because of how easily it rubs off but if you get heat rash from oil based creams then I highly recommend trying this,0.198,0.049,0.753,0.9775,Positive
Ive really struggled to find a face sunscreen that didnt clog my pores or make my face go really oily and so far this has not disappointed Its really lightweight soaks in quickly and leaves my skin feeling soft but not oily or greasy The only thing Im struggling with is the amount to put on  it spreads really easily and when Ive put too much on Ive noticed that I get it forming into little white strands that I can just brush off but if I dont they stick to my skin,0.068,0.058,0.874,0.0052,Neutral
I havent tried this product with make up over the top when I used alone over my normal skin care it was ok and not greasy at all  not to be too fussy but it could be a little chalky if you were to put more products on top,0.147,0.03,0.823,0.5859,Positive
I will get straight to the pointItem arrived dirty I mean actually dirty half of the tube see photo was covered in something that looked and felt like mud This was not a transportation issue as the delivery box was clear inside On top of this the product was open and it was unclear whether someone had used it or did who knows what to it For a skin care product this doesnt inspire the minimum level of confidence or trust How is one supposed to put this on their face after this especially considering the nature of the productVery disappointed come on guys,0.154,0.115,0.73,0.5722,Positive
I have VERY sensitive skin and would never normally dream of using normal sun lotion on my face However after reading the reviews I thought I could trust this not to cause me to break out in a reactionWell that was justified as Ive had no adverse reactions at all And its a cooling easytouse lotion that sinks right in leaves no reside and is fine underneath makeup or other mousterisersHowever despite applying it every 2 hours as stated whilst its stopped me from burning it hasnt stopped the melasma that I get at this time of year the blotchy brown skin that is worsened by sun exposureSo its fine for normal use but as a complete sun block I dont think it works,0.054,0.12,0.825,-0.7367,Negative
It doesnt leave any whitecast but I thought it would be great for my oily skin as its oil free but it does make my face greasy,0.327,0.0,0.673,0.9037,Positive
It isnt available from the UK only USA  I purchased this product and the delivery timescale was only 2 weeks although it advertises it could be longer  There were no customs charges either for receipt of international goods  Its a white fluid but blends in clear and smooth with no caking  Brillant sunscreen and I would definitely buy this again  I have acne prone skin so I use it on my face neck and chestI do prefer aromatherapy or organic products but the facial sunscreens for acne prone skin are fairly relatively expensive 40 for 50mlPreviously I used La Roche Posay Anthelio AC antishine matte fluild 50ml facial sunscreen 16 but I found it very time consuming applying it You had to be careful how much you apply  I found it made my face whiter once applied and it caked around drier or hairier areas on my face such as upper lip eye brows and hairline  So I wouldnt recommend this product and I wouldnt use it again myself,0.052,0.053,0.894,0.2065,Positive
This is a great sunscreen if you dont have sensitive skin It blends really well into the skin and sits lovely under makeup However I had to wash this off after only a short time because it stung like crazy I assumed that being Neutrogena it woud be good for all skin types but sadly not  I guess  it is because it is a chemical suncreen rather than mineral based Hence why it blends so easily but reacts with sensitive skin,0.167,0.062,0.771,0.7976,Positive
I thought I had found the perfect facial sunscreen Its non greasy doesnt bring me out in spots looks and feels matt sits well under makeup and doesnt cost the earth However to my great dissapointment I have found it makes my eyes water and sting so badly and persistently I dont put it on my eye lids but around the eye and forehead but somehow maybe sweat It always migrates to my eyes and its very uncomfortable So dissapointed because I thought this was the one,0.072,0.071,0.858,-0.2228,Negative
Was sceptical at first because I have oily combination skin in and easily break out I bought this based on online information not personal recommendation so wasnt holding my breath on on its ability to be compatible with my skin I have been using this for a week no breakoutsdont use primer anymore because this mattifies my skin for over 8 hours absolutely brilliant product cant recommend it enough for Asian oily combination skin prone to breakouts and temperamental Will definitely be buying this product again it is so worth the price,0.141,0.065,0.794,0.8163,Positive
Cause reaction on skin hot and slightly stinging Might be a problem for sensitive skin But it is true that it is not greasy at all,0.13,0.065,0.806,0.431,Positive
Horrible to my skin I have combi skin and a bit sensitive I used it for a while everything was fine but one day I felt like my skin burns Dont recommend,0.143,0.151,0.706,-0.0683,Negative
Excellent product very soft  clear youll not see goast face  just a smooth clear face I hate that it is more expensive than a grait French product as La Roche Posay or Vichi the price is the only reason I may not buy it again ,0.189,0.074,0.738,0.6962,Positive
1010 would buy again The formula is not greasy at all it absorbs into the skin quickly there is no white cast it does not smell of anything and it does not dry out the skin I have oily skin so this product is perfect plus you dont need much a little goes a long way,0.065,0.039,0.896,0.3612,Positive
Wearing under makeup its not bad Has an unpleasant smell on first applicationMakeup sits ok until about 4pm when the shine starts to show through Happy enough for the price but was hoping for more,0.23,0.049,0.721,0.7597,Positive
But expensive innit,0.0,0.0,1.0,0.0,Neutral
Its nice but I ve too sensitive skin I use it every day it gives a glow but I feel like burning slightly Its ok though I dont mind,0.264,0.0,0.736,0.7602,Positive
It absorbs really nicely and seems to work pretty well at the beginning especially since I have acne prone skin and break out very easily until after a while Ive noticed that touching the skin seems to make the suncream rub off in small pieces on certain areas of my face which can be really irritating as you can see small white bits on your face and have to try and dust it off without causing more cream to rub off,0.148,0.037,0.815,0.8399,Positive
As soon as i put this on my face it started stinging I tried it a few times with no luck so ended up chucking it which is a massive waste of money especially considering i have used much cheaper options before and they did not irritate me For reference i have sensitive dry skin,0.096,0.09,0.813,0.0854,Positive
Does not have seal or box just came in the bag and looks like someone already used it I only had it delivered today Very disappointing,0.086,0.12,0.793,-0.2484,Negative
Bought for my daughter who is fussy about sunscreens on her face She says its the best shes ever used and doesnt feel greasy like most,0.139,0.07,0.792,0.4749,Positive
the product is ok for me im east asian therefore my skin isnt whiteits more like light tan the smell is just rightnot too strong  smells good actually its not sticky and doesnt leave white marks when u spread or use it properly HOWEVER the only thing i didnt like about it was it made my skin dry especially to my nose area so i strongly recommend you to use moisturiser first then apply this after so far this is the best face sunscreen ive used,0.197,0.048,0.756,0.9276,Positive
Great product and it didnt break me out which is great It does what it claims to do However it ended up adding up to 19 including the postage which I think is a little steep for the amount of product you get and it being drugstore But apart from that its a good product,0.154,0.0,0.846,0.8381,Positive
This product is exactly what I wanted high spf and lightweight although I am very pale so would probably leave a white case on anyone more tan than me Also sometimes it is a bit too harsh for my skin and makes it sting,0.0,0.103,0.897,-0.5209,Negative
after heavy research and reading reviews I bought this product for my face for protection but want something that wouldnt clog my pores and cause me to break out acne skin that is under control and want to keep ornaments that way This I can confirm does exactly what it says Wont break you out and great protection from the sun Very happy with it It is a little thinner in terms of texture to normal sunscreens but you get used to it Just rub it in and you dont get any white on your face Fab product,0.167,0.0,0.833,0.9586,Positive
I have dark skin and most sunscreens leave a white caste on my face however this sunscreen does notIt moisturises and doesnt sit on the skin however it stings alittle when applied but this goes away in afew minutesOne application lasts me the whole day and my skin looks fresh and nice at the end of the day when I wash it off,0.102,0.019,0.878,0.7514,Positive
I have oily skin and this is fantastic at keeping my skin matte It lasts all day and I havent had any breakouts So glad I found this,0.231,0.0,0.769,0.7841,Positive
Cant belive i thought this one would be good Its a gd consistency dont get me wrong and gave my skin no irritation or rash But it started pilling and i felt my face then looked in the mirror Absolutely awful Thankgod i wasnt going out or my makeup might look like the rocky horror show Will never buy rhis one again what a waste of my money,0.087,0.236,0.677,-0.9155,Negative
I have rosacea and this didnt make me break out It is a fairly light product and I pat it onto my skin to let it sinks in doesnt really need rubbing in like some thicker sunscreens Im very prone to sunburn naturally and Im on medication that makes me even more sensitive to sunburn than normal and I have not been burnt with this on,0.039,0.0,0.961,0.3612,Positive
This product is amazing Because i am black lightmedium skin tone i was worried it would leave a white mask on my face like the other sunscreens do but this one doesnt It blends right in and doesnt make my face look oily This product is good if you have sensitive and oily skin It really doesnt clog pores too and its not heavy so your skin can really breathe Its also a great sunscreen i used it when i went on holiday to Africa and i didnt burn or change skin tones I am so happy i found this product Its worth it for the price too cause ive been using it everyday for the past month and it hasnt run out,0.195,0.02,0.784,0.9787,Positive
I have tried various sunscreen products over the years that I can wear under my makeup  This product is fantastic  It goes on and sinks into the skin without leaving and shiny residue  Mineral or cream foundations go on as usual  I used this product last year and sat on the beach in England when it was around 82f  I did not burn at all when usually my face goes bright red  I will be looking at other Neutrogena products to buy as I have been so impressed with this,0.115,0.0,0.885,0.8883,Positive
I first bought it on holiday in Las Vegas as I ran out and it was great I went to the Canary Islands and used it all over Apart from a really mild patch of prickly heat after a week of using it it was great,0.219,0.038,0.743,0.875,Positive
This is the best spf Ive ever usedDoesnt clog pores,0.318,0.0,0.682,0.6369,Positive
I would give 5 stars  non greasy light pleasant to skin etc but when i apply it i get a tingling burning sensation around the eye area for a bit it goes away but is quite strong and unpleasant the directions dont say avoid eye area its specifically for face so i would expect it would be suitable for eye area too on the other hand many effective creams tingle when applied but this tingling is quite strong maybe im doing something wrong i dont really have a sensitive skin,0.218,0.083,0.699,0.9327,Positive
I really like this brand and this is a great product for your skin I have dry skin and it feels really nice,0.37,0.0,0.63,0.8746,Positive
Received this product properly sealed Thankful for this I hope this really wont make my skin breakout Been using it for few days now and I have noticed that I am not having breakouts,0.185,0.0,0.815,0.765,Positive
I was looking for a face moisturiser with good spf but I struggled finding something that did the job well Now I mix in a pea size amount of both my moisturiser and this cream and it does the job well My skin is smooth and grease free all day,0.214,0.057,0.73,0.8225,Positive
Delicate on my sensitive skin,0.231,0.0,0.769,0.0516,Positive
Been using this for a few months and put on everyday as I have some hyperpigmentation Really good and although a bit thick consistency it has not caused any breakouts Overall will carry on using it and have even got my teenage daughter onto it,0.072,0.0,0.928,0.4927,Positive
I have used this product for the last two years and it is excellent  I cannot recommend it highly enough for offering protection to your skin and stopping break outs that occur so regularly with other face sun lotions give it a try you will not be disappointed,0.123,0.073,0.804,0.549,Positive
This product was recommended by Dr V on You Tube hence bought it Really pleased with it,0.263,0.0,0.737,0.6115,Positive
Its so important to protect your skin against any sun damage and this is perfect Super light non greasy absorbs really well and no breakouts what more could you ask for,0.335,0.127,0.538,0.8514,Positive
1010 doesnt make me get spots and is so light weight,0.0,0.0,1.0,0.0,Neutral
I love this  product I am an Indian lady and this is the only stuff that does not stay white on my skin It vanishes completely but protects my hyperpigmentation from getting any worse I know it works because my husband is white and has been using it when he goes to play golf He usually comes back burnt and red but not with this stuff Happy days all round,0.176,0.052,0.772,0.874,Positive
I really struggle with acne flare ups from SPF products but have had no problems with this after using it everyday for weeks,0.0,0.3,0.7,-0.799,Negative
Ive tried various creams over the years and always had problems with breakouts until trying this one about 4 years ago now I always use this and basically dread the day its discontinued or something  Definitely recommend this cream,0.118,0.13,0.752,-0.128,Negative
Didnt have much use for it last Summer but it seems as thought it will be OK Would have preferred one with a slight tint to it as it looks rather white on my face,0.106,0.0,0.894,0.5993,Positive
Didnt have much use for it last Summer but it seems as thought it will be OK Would have preferred one with a slight tint to it as it looks rather white on my face,0.106,0.0,0.894,0.5993,Positive
Fantastic high factor cream that I wear under my makeup everyday Very light and non greasy doesnt cause spots or oily skin has no smell to it and lasts ages Perfect,0.2,0.06,0.74,0.7269,Positive
I dont understand what this sunscreen contains but this made my face feel very strange I had a numbing feeling after putting it on That scared me so much I decided to not use it anymore Be aware if you have sensitive skin as this might not be good for you Honestly I dont have that sensitive skin and I still reacted to it somehow Another thing is Neutrogena was just criticized for claiming that they offer high protection Most of these dont offer that high protection so for instance here it says 55 but you only get 3035 in reality Dont be fooled,0.075,0.139,0.787,-0.811,Negative
In love with this product ,0.512,0.0,0.488,0.6369,Positive
Really good option if you are looking for a good SPF its cheap  It is not soo lightweight but it is just perfect enough for my even prone acne skin  i recommend this to anyone ,0.301,0.0,0.699,0.9099,Positive
GOT ACNE use this I use this spring through autumn Love it Not sticky and smells fresh Wish it didnt have a scent but it doesnt irritate or block your pores Highly recommended to me by my Derm Only problem it makes the skin look a little dewy at the end of the day which I love but if you hate having oily looking skin I would look elsewhere,0.245,0.102,0.653,0.8764,Positive
Not sure whether it works with acne prone skin as I still have milia type spots after three months of use I have continued to use it as I use Differin gel every night After cleaning toning and moisturising I wait 5 minutes and then use sunscreen Initially it does burn for a few minutes causing some redness but then stops Dont think I will repurchase as my skin feels greasy afterwards,0.0,0.051,0.949,-0.3359,Negative
Very lovely product i suffer from acne breakouts since the age of 14 and am now 22 this product doesnt seem to clog my pores lovely product Also it doesnt leave a white look on my face and im a fairly light skinned Asian,0.186,0.075,0.739,0.6778,Positive
Ive had loads of disagreements with face SPFs and tried so many others but this one is definitely my favourite It blends into the skin nice and quick so your face doesnt look oily or greasy So nice to apply as well its such a lovely product and hasnt irritated my sensitive skin Used it every single day and near the end of my bottle so looking to repurchase,0.259,0.022,0.718,0.9687,Positive
Its amazing makes your skin feel velvety No oiliness whatsoever,0.271,0.157,0.571,0.3818,Positive
The best sunscreen for oily skin ever after I have tried 20 or more different branches for oily skin It leaves no white mark whatsoever It absorbs quickly to the skin as if there was no sunscreen appliedI have recommended it to all my friends and acquaintances when we talk about skincare and makeup,0.148,0.072,0.78,0.6908,Positive
This ended up causing a horrible rash that looked like burns on my skin It contains cinnamon bark which can be an allergen Not easy to blend into face and can pill,0.066,0.226,0.709,-0.7274,Negative
Light and easy to apply Makes my face super shiny so some powder or foundation is a must,0.312,0.0,0.688,0.7783,Positive
Very good,0.762,0.0,0.238,0.4927,Positive
dont get this because it leaves a white cast and is note nice on the skin at all I recommend you invest in the biore sunscreen,0.194,0.0,0.806,0.6486,Positive
I had a similar product from Neutrogena a few years ago which I felt worked much better I found this went on quite thick but left my skin matt which was good however didnt prevent any breakouts unfortunately maybe it was just bad timing on my skin would probably try a different product next time,0.099,0.152,0.749,-0.4873,Negative
I love the this lightweight sun cream Came quickly,0.375,0.0,0.625,0.6369,Positive
This is the third time Ive bought this product  Husband had skin cancer and has to use protection all year round  He also suffers with severe acne to the point where he has such greasy skin he gets abscesses under the skin  Uses this with faith  Not at all greasy  No smells And disappears straight into the skin  Never causing breakouts  Fantastic,0.062,0.231,0.708,-0.9173,Negative
Love this productI always suffer with spots when on holiday from the suncream I use on my faceThis product is well worth the moneyNot one spotEasy to apply sank in well and skin felt smoothNo residueNeed to reapply after being in water,0.252,0.068,0.68,0.8176,Positive
