Review,Positive,Negative,Neutral,Compound,Sentiment
asizebase 3,0.0,0.0,1.0,0.0,Neutral
What I love about this sunscreen is that Unlike many other products that claim to control oil this actually makes me less oily and stays matte for a long time Goes well under a little makeupWhat I hate Burns around the eyes especially when I wash it off Its very hard to spread and you need time to work it on sometimes it pills and sticks to baby hairs Leaves a bit of a white cast Its not too obvious on my light medium skin tone but I wouldnt recommend this for tan or deep skin tones,0.044,0.066,0.89,-0.2668,Negative
It works well and doesnt feel greasy or look shiny  BUT I would not advise using it on your forehead if youll be sweating I dont know about swimming because it WILL run and get in your eyes and it WILL NOT feel good  Yes this is true of many sunscreens but this one seems to be worse than average in this regardSo yes use it  It works  Its good  But be aware you may need to use a different product above the eyes,0.092,0.138,0.77,-0.6657,Negative
I was using another system for acne that included sunscreen but it was very oily I purchased this as a replacement  I love it,0.234,0.0,0.766,0.7783,Positive
Easy spreading daily use,0.492,0.0,0.508,0.4404,Positive
Its a good product it just has a strange smell ,0.271,0.168,0.561,0.2732,Positive
my skin loves this sunscreen it feels moisturizing and lightweight and its perfect to wear under makeup,0.33,0.0,0.67,0.8126,Positive
This sunscreen texture is great for my acne prone skin,0.313,0.0,0.687,0.6249,Positive
Great for oily skin cuz it absorbs oil well so not very moisturizing,0.36,0.0,0.64,0.7351,Positive
This is the only sunscreen that doesnt make me break out,0.0,0.0,1.0,0.0,Neutral
Does a good job for hours of activity,0.326,0.0,0.674,0.4404,Positive
Love this sunscreen it really is nongreasy and doesnt make your face shine  Amazon had a good price when I bought it,0.341,0.0,0.659,0.8316,Positive
Love love love,1.0,0.0,0.0,0.9274,Positive
This sunscreen is definitely not for oily skin easy to spread but stinks the eye area a little bit You need to try it first to see if its really suitable for you Also it doesnt leave white cast,0.121,0.06,0.819,0.1336,Positive
Not the worst but Ive tried better Took forever to rub in but definitely made me very dewy and my skin looked amazing No white or grey cast and no bad scent either Would recommend I just got tired of rubbing for so long,0.29,0.214,0.496,0.6245,Positive
Absolute baseline of a product for the money it wears like a 28 dollar plus product without the fancy branding I mix mine with after shave lotion when Im done shaving,0.085,0.0,0.915,0.3612,Positive
After trying a ton of sunscreens I think I have finally found my white whale You cannot beat this price for a sunscreen that soaks in as well as this does Its easy to wear under make up and wont cause breakouts I had been using Elta and Intellishade but will use this exclusively moving forward,0.067,0.0,0.933,0.3612,Positive
I use this daily and I have noticed a big change in my skin My skin doc recommends this and he agrees my skin is looking better I am 70 and have very few wrinkle to begin with and using this keeps my face soft and I never get sun burns or tan,0.128,0.0,0.872,0.6808,Positive
Works great Does not leave any white residue  does not leave your face oily,0.368,0.0,0.632,0.6593,Positive
Good value lightweight and easy to apply,0.672,0.0,0.328,0.802,Positive
it is a sunscreen but more so for the beach It DOES leave a white cast on dark skin but it is minimal I used with a light moisturizer and this somehow made my face feel DRYER than before it spreads with difficulty,0.0,0.106,0.894,-0.5267,Negative
Only sunscreen that doesnt make your skin oily Some sunscreens by time becomes caky or oily but this one by time makes my face better I even use it in the evening when there is no sun But since they changed formula it started to leave white cast when applied big amount You need precisely control the amount you put,0.06,0.064,0.876,0.1901,Positive
it is good but upon application it touched my eyes with alot of tears came Avoid near eyes,0.088,0.233,0.679,-0.4939,Negative
I appreciate the sunscreen for not being greasy compared to the many other brands of sunscreens Ive used before But reapplying it to my face is not always great leaving my face to white or leaving some white spots here and there,0.041,0.098,0.861,-0.556,Negative
I was looking for sunblock to use while walking around my city not the beach This sunblock is works great is fragrance free and feels light weight  The only negative is that it is thick to apply a white cream that you will really need to rub in well I wish they could make this in clear  Otherwise a good purchase that does not turn your skin albino weight as the chemical frees tend to do,0.227,0.042,0.731,0.9349,Positive
fits perfectly on your skin does not become too white and also not greasy great to use in the morning in your daily routine,0.142,0.112,0.746,0.2278,Positive
I dont know why I had problems with this sunscreen which has chemical filters It shouldnt have had a cast but DID on me Asian I found it so hard to spread evenly and it does not dry down SHEER you have to really work it out to get it even because you will be left with white streaks if you dontEven when I did apply it evenly I still looked a little like a ghostI bought this to travel to Colorado which is soo dry but if really wasnt moisturizing almost a little drying which makes sense because IT IS for people with more oily skin However MY PROBLEM was that when I applied it over moisturizer sometimes it piled or left more intense white streaks on my face,0.037,0.068,0.895,-0.6248,Negative
My husband hates lotion Sunscreen hand cream whatever  if it gets rubbed into skin he hates it We recently took a trip to Disney and I brought this along for my own use because Im prone to breakouts and this ended up being our familys default sunscreen for the trip It rubs in easily smells mild and we had zero sunburns despite being out for hours at a time for an entire week at a theme park We used most of the tube over the week of travel which isnt bad for three people with multiple applications a day Im definitely getting this again to use all summer long,0.097,0.05,0.853,0.6542,Positive
This sunscreen is not as oily as many others Ive tried doesnt irritate my skin fragrance free and much more affordable than other options Will keep buying,0.184,0.0,0.816,0.684,Positive
XOXOXOXOXOXO,0.0,0.0,1.0,0.0,Neutral
This sunscreen is gray for my oily skin No blemishes come from it its not greasy and leaves a matte look,0.0,0.104,0.896,-0.296,Negative
No ugly white residue,0.0,0.733,0.267,-0.6705,Negative
honestly this is my favorite part of my skincare routine maybe because its the end of it but it also feels so nice with the exception of it getting into my eyes one bottle has lasted me about 6 months and it doesnt make me feel oily at all when i go outside after applying it really feels like i have spf on ,0.184,0.0,0.816,0.9117,Positive
Product is good and works well  This purchase was disappointing as the sunscreen smells musty Would not buy from this supplier again,0.184,0.118,0.699,0.2023,Positive
Better than using ordinary moisturizer under makeup,0.326,0.0,0.674,0.4404,Positive
Excellent sun product Most products break me out this one keeps my skin absolutely clear  The cream does the job and is very fair in price Its creamy and yet dries rapidly and it has an pleasant smell,0.269,0.0,0.731,0.9097,Positive
Its a good sunscreen but after a couple of minutes with it on my face is already oily,0.115,0.0,0.885,0.2382,Positive
,0.0,0.0,0.0,0.0,Neutral
It spread so easily and leave little to no residue,0.231,0.251,0.518,0.1854,Positive
I figured if this was good enough for my face its good enough for the rest of my body Absorbs quickly and does not feel like you are covered in sunscreen,0.166,0.06,0.773,0.5705,Positive
Well for starters its making little to no change in my skin Its oxybenzone  free which is supposed be good for me because I have dark skin But it still cast a white shadow I dont know why but when I spread it across my face it also like curdles and its like how it is with like dead skin but its with the product I dont really know how to explain it well,0.211,0.087,0.702,0.8243,Positive
Love this face sunscreen so much I have skin on the oily side anyway and this doesnt make my face greasy or cause me to break out Would highly recommend,0.206,0.0,0.794,0.7902,Positive
I have pretty durable and unsensitive skin ie my skin doesnt flare up burn or itch to most products but am horrendously prone to acne and hyperpigmentation and most sunscreens are really thick and make my face feel pretty sealed up and unbreathable This sunscreen is probably the best Ive come across so farIt still has the usual odor and consistency of typical sunscreens although it is slightly more fluid and subtle so a small amount can be applied easily and my skin can still breathe Once applied it does leave a little bit of a shine but not nearly as much as regular sunscreens but I think thats a fair trade for protected skin A thin layer of it wont leave your skin looking whitepale either but an ample or generous amount will ample being a teaspoonfullApplying makeup after isnt any issue either granted that you either rub the sunscreen in thoroughly and allow at least of couple of minutes for it to settle I use liquid foundation but for those who use powders you might have to wait longer for it dryAs stated in the description application is necessary at least every 2 hours or every 80 minutes if youre in water or sweatingI prefer to wash it off as soon as Im no longer outdoors but I have left it on for an extended period 67 hours and didnt feel my skin becoming too oily as it would with any other sunscreen I didnt break out from it either which is a plus and Ive been using it almost every dayFYI for sunscreens in general many common ingredients of sunscreen like avobenzone and homosalate included in this product as well are good at either filtering blocking or absorbing UV UVA UVB rays which is great but I would highly recommend washing it off as soon as you no longer need the protection Like everything else in this world the sunscreen isnt infinite  its made of molecules and chemicals that will break down into other compounds These ingredients in sunscreen have been found to breakdown into a variety of organic compounds some of which that can cause cancer  Im not saying that this guaranteed and will happen to you but be wary of leaving it on your face for extended periods of time I dont know the details of how long these ingredients typically last in their intact UV protecting state but by guessing from the product description stating that it should be reapplied at least every 2 hours my guess would be that  a couple hours So overall just make sure youre cleaning it off properly Cleansing oils and cleansing balms are useful for removing oilbased materials like sunscreen,0.134,0.043,0.823,0.9931,Positive
I kinda liked it cuz it was easy to spread on face and its light weight you dont feel to heavy on your face and it is moisturizing ,0.178,0.0,0.822,0.6605,Positive
I have sensitive acne prone skin and this gave me good protection without breaking out my skin I also used it under makeup and it didnt affect the look of my makeup even hours later,0.083,0.0,0.917,0.4404,Positive
I ordered this product because I was looking for a sunscreen that didnt have Oxybenzone in it It causes hormone disruption in humans affecting estrogen production particularly in women and testosterone production in men It also bleaches coral reefs and can cause mortality in fish Now think about that being absorbed into your skin not so good rightAnyway thats why I went for this because its FREE of oxybenzone and much more affordable than others options such as Paulas choice which has an Oxybenzonefree sunscreen too Please note from what I can gather its only the SPF 30 that is free of it not the SPF 55The product is oil free so its great for oily skin and Ill say once its dried in it doesnt feel very moisturising it has a dry feel to it probably because its mineral basedOverall Im giving it a 45 its a GREAT price that is free of a toxic chemical also linked to cancer with a reasonable SPF level Definitely a great daily sun screen that doesnt break me out It looks like it will have a white cast but if you blend it in that disappears Ill update this tomorrow with its compatibility with makeup cause Ill be putting some under my foundation and seeing how it feels,0.106,0.082,0.812,0.3285,Positive
I use this twice a day and I never have a rash or break out from this brand of sunscreen Love this stuff,0.275,0.0,0.725,0.7549,Positive
I just had a Dermal Cell removed and needed to make sure this doesnt happen again I never used sunscreen on my face since my makeup had it But its so important to use a sunscreenblock before adding your makeup for double protection This Neutrogena cream goes on smoothly and disappears into the skin Then the makeup just glides right over  This says its clear but its white It still blends right in with no white residue or shine just a nice matte finish  Ill be buying more,0.121,0.099,0.78,0.2958,Positive
First time using this brand wanted to compare it to a tinted mineral sunscreen I also bought I favor the tinted one Australian Gold but this one worked amazing well for being outside at a water park all day for July 4 I applied it two or three times and my face was wonderfully tan but not burned whatsoever I am fair skinned with an olive skin tone Need to rub this sunscreen in more than the other brand I tried One thing I did notice is that this one made my face feel prickly not super fun but half the people who used it that day in my group also felt that slight burning sensation Im not sure if thats a sensitivityallergy to some ingredient in it but it didnt leave any weird redness or marks on my skin no breakouts no sunburn and the feeling went away after a few minutes All in all pretty happy that I brought that along,0.173,0.098,0.729,0.9317,Positive
This is a very affordable and good sun protection that I have ever you in US The one thing I dont like is that sometime it can not combine well with several moisturizer skin care that I use,0.158,0.097,0.745,0.533,Positive
Wore it for the hot Puerto Rican sun for two weeks and wow usually sunscreen mixed with sweat and you skin is so broken out  On my very sensitive combination skin it worked so well breakout free I was shocked,0.201,0.125,0.675,0.5878,Positive
I was looking yet again for a facial sunscreen for summer to use under makeup  Im not very faithful about using sunscreen  I know I should be yet living up north and being one who stays indoors a lot I dont worry about it like I should  But when summer comes I try to wear one most days  But I hate the way they feel and every year I am on the hunt for one that is not greasy or heavy wont cause breakouts and works well under makeup  And is not expensive to boot  That seems to be a really hard combination to find  The Neutrogena Ultra Sheer is sort of close but  I still find it feels to greasy and heavy on my skin  I gave this one a try this year and I really like it As I apply it I feel like oh no this is going to be greasy and heavy too  But no as soon as I am done applying it disappears  I really dont feel it on my skin after that  It doesnt leave a white cast once it is applied and it works well under my makeup  It seems to offer great sun protection  I am very fair and burn easily and I have had no problems  It is a generously sized tube for the price  I use it on my neck and chest as well  I have had no problem with my eyes stinging as I use it under them  Of course I am careful not to get it my eyes  No new pimples since using it no rashes or other irritation either  I think its a good product and I recommend it,0.142,0.132,0.726,0.3,Positive
Ive been using Neutrogena Ultra Sheer DryTouch Sunblock on my face for a few years it is really good  But when I saw this Clear Face version I decided to try it  I actually prefer this Clear Face because it is so sheer feeling  oilfree  They are NOT the same product and feel different when appliedI like it because it disappears in to my skin leaving it matte not shiny at all  The Ultra Sheer is a bit more like a lotion Its not greasy but does leave a feeling of lotion on my face  This Clear Face is so light I hardly know Im wearing it  Even my husband likes it  that is saying something because he is not a lotionontheface kind of guy  And there is virtually no scent which is great since its on your face where you really notice scentWhen you first put this on its quite whitewatery  you may think its a disaster but just lightly smooth it in  it disappears quickly  And it does block the sun  I have no burning when I wear this sunscreenIf you have sensitive skin this may not be the product for you  I felt a slight burning sensation when I applied it  It went away quickly but I could see that being a problem for some people  I also got a little on my lips  they still felt slightly irritated the next day  The ingredient list is interesting  includes cinnamomum zeylanicum bark extract which is from the cinnamon tree and cedrus atlantica bark extract which is from a cedar tree  Both have antiseptic properties which is probably why they are in this clear face lotion  But they can also cause irritation so if you have very sensitive skin beware The Neutrogena Ultra Sheer DryTouch Sunblock does not contain either of those ingredients and may be a better choice for you,0.131,0.098,0.77,0.9104,Positive
Very good I like this product,0.666,0.0,0.334,0.7159,Positive
This stuff is great Its  more like a nice facial moisturizer than a sun screen its very light and non greasy It is my new go to daily spf facial moisturizer Very good product and super affordable protection from the sun ,0.334,0.0,0.666,0.9521,Positive
product is about to expire,0.0,0.0,1.0,0.0,Neutral
It does its job,0.0,0.0,1.0,0.0,Neutral
This works well as far as I can tell and goes on relatively easily It was highly rated and attractively priced,0.319,0.0,0.681,0.7884,Positive
If youre using powerful retinoids you must also use sun protection every single day My son has acne so we had to be sure that we chose something effective that wouldnt cause breakouts This Neutrogena sunscreen doesnt irritate his skin and its clear and undetectable so he doesnt feel weird having stuff on his face Id recommend for anyone prone to breakouts,0.238,0.0,0.762,0.9343,Positive
Really like this Goes on smooth and even Not greasy,0.237,0.0,0.763,0.4201,Positive
Ive been wanting to add sunscreen into my skin care routine but was scared of breaking out My sister referred me to this brand No break outs I dont feel gross or sticky when its on The protection is there without the extra feel or smell of sunscreen,0.099,0.121,0.781,-0.3002,Negative
This may well be a very good product It just was not good for my skin I still broke out I have not used it much so I dont have a good opinion for you,0.296,0.071,0.633,0.8351,Positive
Absorbs quickly and doesnt feel great or cause breakouts Great sun protection,0.236,0.189,0.575,0.2037,Positive
Ive used Neutrogena for years happy with this product,0.316,0.0,0.684,0.5719,Positive
Is not greasy  goes on smoothGood protectionLove Neutrogena products,0.0,0.0,1.0,0.0,Neutral
I love Neutrogena products I know I can always trust them This product doesnt clog my pores which is important since I have awful acne prone skin The only reason Im giving it a 4 star is because when I use it on top of my Benzoyl peroxide it burns Bad But this could just be me unknowingly combining chemicals I dont know Ive never had this problem before But not a bad product and I definitely recommend,0.233,0.099,0.669,0.8551,Positive
Ive trusted many Neutrogena products for about 30 years now especially Norwegian Formula hand cream in winterMy dermatologist recommends this so he didnt have to twist my arm The primary thing that I like is that it spreads easily Im sure it does the trick on sunblocking but I have no way of claiming its SPF properties,0.175,0.063,0.761,0.6036,Positive
This is a fantastic product for the face,0.375,0.0,0.625,0.5574,Positive
Its very lightweight and easy to ply I have use this with foundation it didnt work for me So i would recommend not doing that,0.221,0.0,0.779,0.7133,Positive
I really really wanted to like this as much as the majority of reviewers seem to unfortunately however in my opinion this did not live up to the hype Dont get me wrong it wasnt terrible it just wasnt great either For reference I have very oily acneprone skinPROS Offers hardcore broadspectrum protection with myriad types of sunscreens Doesnt leave a white cast Nice consistency light feeling Works well under makeup and with other products Decent priceCONS All of the sunscreens used are chemical sunscreens which is a bit odd since physical sunscreens are less irritating than chemical ones and as all acneprone people know irritation leads to breakouts Moreover not only is zinc oxide a physical sunscreen nonirritating and noncomedogenicnonacnegenic it can actually help to treat and prevent breakouts So its odd that they didnt use it in this sunscreen for acneprone skin and instead exclusively used sunscreens that at best are irritating and at worst comedogenic which is the opposite of what this product is supposed to do Probably because of the aforementioned point this sunscreen seemed to be no better at preventing breakouts than any other facial sunscreen Its not really any worse than most other facial sunscreens either however considering that its primary claim is that it wont cause breakouts its frustrating that thats not the case The claim that this leaves your skin matte is complete bs at least in my experience In fact literally just now as I was writing this review my boyfriend asked me if Im okay because my face is so shiny that it looks like Im drenched with sweat Awesome NOT the look I was going for This could easily be something that only I experience but for me if I use this sunscreen multiple days in a row my skin starts burning like crazy when I put it on Not sunburning mind you but really harsh stinging as though Ive just had an intense chemical peel or am using a heavyduty retinoid Not sure what causes it to burn like that because my skin is by no means sensitive Because of this I alternate it with another sunscreen and use it only every other day or every third dayFinal note Of course skin care products work differently on different people Obviously this product worked very well for the majority of reviewers So Id recommend giving it a chance even though I personally was not wowed,0.125,0.083,0.792,0.9281,Positive
Love it helps so much,0.694,0.0,0.306,0.7783,Positive
Great,1.0,0.0,0.0,0.6249,Positive
This is non greasy and blends in super easy Its highly moisturizing and makes your skin look great,0.421,0.0,0.579,0.8979,Positive
Of course it smells like sunscreen which isnt my favorite scent but it applies easily and hasnt broken me out Thats all I can ask for since I got serious about sunscreen after being prescribed tretinoin for my acne,0.189,0.074,0.738,0.7176,Positive
This has been my favorite sunblock for 5 years to my face I have a acne prone skin and this is the only sunscreen oil free than I know I tested much before but its is cheap and it have a fast dry without white trail over my face,0.092,0.0,0.908,0.4854,Positive
I am happy that I purchased this item I have a medium to darkskinned complexion with a mix of tzone oil and dryness in the other areas of my face I am giving this information because I find it useful to know the skin type and complexion when I purchase an item I used to use the Visibly Even Daily Moisturizer with Sunscreen Broad Spectrum SPF 30 for years to help with my hyperpigmentation but then I stopped because I relocated to the northwest where it was more shaded and rainy and it also left my face feeling greasy throughout the day even under my makeup However let me tell you that the suns rays still penetrated the clouds and I began to experience hyperpigmentation again in my face So I switched to this product the Neutrogena Clear Face Liquid Lotion Sunscreen for AcneProne Skin Broad Spectrum SPF 55 I LOVE IT There is a slight white film that is on the face after the initial application but it fades quickly The sunblock is thick a little goes a long way it works well whether I wear makeup and it does not seem to encourage the oil I doubt a greasy nose or tzone will ever change for me but I use other products to reduce it  I am delightedI hope this review helps someone else,0.129,0.048,0.823,0.9572,Positive
This product dries fast and never travels into my eyes like the gooey sunscreens do  I apply makeup over it  The makeup also has a little sunscreen so Im protected to 50 SPF total  This product also feels good on my neck hands and arms  Im super careful now and wear sunscreen almost everyday except when I go out at night because I had THREE surgeries in seven wks to remove basal cell carcinoma off the end of my nose and two more surgeries to successfully graft skin to cover the hole  like a sunroof on the end of my nose  Ive worn sunscreen since the 1970s and no one in my family has had cancer so I didnt think Id get it  WRONG  Did you know you can get the harmful rays THROUGH the drivers side window even if its tinted  Thats why so many facial and neck skin cancers are on the LEFT side  This product doesnt cause breakouts which is another problem I had with oily sunscreens  This is the 4th container Ive purchased because my husband wears it also EVERYDAY,0.1,0.077,0.823,0.5732,Positive
