Review,Positive,Negative,Neutral,Compound,Sentiment
Works well,0.677,0.0,0.323,0.2732,Positive
I have pcos and have had acne problems for a long time I was nervous about putting any lotion on my face but this worked well Didnt notice it causing any problems at all,0.072,0.19,0.738,-0.5106,Negative
Didnt make my very sensitive face break out and protected it from the sun in SUNNY Mexico,0.3,0.0,0.7,0.7531,Positive
Best sunscreen,0.808,0.0,0.192,0.6369,Positive
This goes on super light and protects my face all day,0.408,0.0,0.592,0.7351,Positive
Light and not greasy  Absorbs well,0.0,0.266,0.734,-0.2057,Negative
Super Runny I havent noticed it cause acne yet Ive only used it twice but it is so runnyyyyy,0.126,0.0,0.874,0.3506,Positive
I like it but it is a little thick for my liking,0.398,0.0,0.602,0.6486,Positive
Such a nice smell  light and feels like moisturizer Love it ,0.576,0.0,0.424,0.8591,Positive
Blocks the sun and doesnt clog my pores This lotion is exactly as they describe it Its good for the long days outside without having to worry about getting pimples,0.155,0.056,0.789,0.5277,Positive
Excelent,0.0,0.0,1.0,0.0,Neutral
Received product in excellent condition Thank you,0.554,0.0,0.446,0.7351,Positive
This is great for sensitive skin like mine,0.524,0.0,0.476,0.765,Positive
Beautiful product that unfortunately stained and ruined three sweaters in first week of use I could not see the discoloration until after they were washed and the stains set also stings around my eyes Otherwise made my skin look really nice Loved that it helped  smooth out scars and imperfections beautifully  I was wearing product on my face and neckIm sure it does protect from the sun maybe in a v neck  bathing suit or just applied to face the staining might not be an issue,0.199,0.055,0.745,0.9357,Positive
I was really looking forward to using this as Im moving to Nevada and will have to use sunscreen most of the year However I was really disappointed as it made my face red stung my skin and left little white particles all over my face I dont recommend if you have sensitive skin like I do I should have read the reviews before buying,0.038,0.085,0.877,-0.4594,Negative
Use this as part of a new antiacne daily routine No breakouts from this product in combination with a couple others,0.0,0.109,0.891,-0.296,Negative
Good,1.0,0.0,0.0,0.4404,Positive
Yes,1.0,0.0,0.0,0.4019,Positive
Dont get it ANY where near your eyes,0.0,0.0,1.0,0.0,Neutral
Good leave my face moisturized,0.408,0.169,0.423,0.4019,Positive
I tried another top rates sunscreen from Amazon and my skin broke out immediately Neutrogena is always the best My skin looks great and I feel my makeup goes on really well over it,0.33,0.065,0.605,0.8858,Positive
This is very good sunscreen for specially oily skin,0.285,0.0,0.715,0.4927,Positive
Best face sunscreen I have used so far I use it daily and have no complaints,0.209,0.244,0.547,0.0772,Positive
Great,1.0,0.0,0.0,0.6249,Positive
I would not use this anywhere near your eyes It burns very very bad,0.0,0.253,0.747,-0.6214,Negative
Allergic people DO NOT USEIm allergic and this product gave me a bad allergic reaction,0.194,0.293,0.513,-0.4449,Negative
what I paid was less here on Amazon than what I would have paid in a drugstore BUT the price is still high  youre really just paying for the brand  I would rather go to a drugstore or Trader Joes and pick up cheaper sunscreen that will do the same things and perhaps might even provide more protection,0.023,0.0,0.977,0.0562,Positive
Great sunscreen No breakouts or oily feel,0.363,0.195,0.442,0.4404,Positive
Love the sunscreen Great for your face when it is prone to breakouts,0.43,0.0,0.57,0.8519,Positive
Light clean and didnt make me break out,0.278,0.0,0.722,0.4019,Positive
My face was perfectly clear until I had this sunscreen on for two hours I applied shortly before I went outside to do some gardening for a few hours and washed it off after I was done and immediately noticed the irritation it had caused Im now breaking out across my forehead nose and chin after using it and I also got slightly burnt I used spray sunscreen of the same SPF over the rest of my body but only got burnt on my face,0.054,0.026,0.92,0.3071,Positive
6 people found this helpful,0.52,0.0,0.48,0.5023,Positive
Had terrible breakouts from this product even though it says its for acneprone skin Unfortunately I had to leave my face alone for a WHOLE MONTH to repair the terrible cystic acne that I got from this product Ive never even had acne so deep in my skin before I switched to Paulas Choice sunscreen after such a terrible experience and it is like night and day I guess you pay for what you get,0.031,0.204,0.764,-0.8957,Negative
Waste the money,0.0,0.583,0.417,-0.4215,Negative
Never again,0.0,0.0,1.0,0.0,Neutral
Definitely helps with acne prone skin,0.57,0.0,0.43,0.6486,Positive
Translate review to English,0.0,0.0,1.0,0.0,Neutral
Great price when I ordered this  I use this for my entire body not just my face,0.227,0.0,0.773,0.6249,Positive
Excellent sun screen  fragrance free nongreasy and doesnt irritate my skin which is pretty sensitive I just bought the 100 SPF version to try Highly recommend Neutrogenas sunscreens,0.411,0.0,0.589,0.9363,Positive
I love this Its not greasy and slightly mattifying Works well under makeup I feel like Im not even wearing any lotion on my face,0.299,0.0,0.701,0.8194,Positive
This is the best block I have found for the face Goes on dry feels light great protection for hours after application even when swimming I like it better than the Neutrogena Ultra Sheer,0.314,0.067,0.619,0.8957,Positive
I really like it because it does not leave that greasy felt on your skin When applied on your skin it stays clean and pretty much nonnoticeable I highly recommend it,0.345,0.0,0.655,0.8918,Positive
As good as my more expensive one,0.326,0.0,0.674,0.4404,Positive
Neutrogena Clear Face BreakOut Free LiquidLotion Sunscreen SPF 55 3 oz Pack Of 3  even though I ordered this since it was a Pack of 3 description I only received one 3 oz bottle,0.191,0.0,0.809,0.7096,Positive
This sunscreen does not break me out,0.0,0.0,1.0,0.0,Neutral
This is the only sunscreen my husband can wear on his face because of his sensitive skin It covers well doesnt burn and isnt greasy,0.08,0.0,0.92,0.2732,Positive
the only sunscreen that I use wonderful coverage and protections must reapply as recommended,0.333,0.0,0.667,0.6705,Positive
Nice sunscreen,0.737,0.0,0.263,0.4215,Positive
I strongly recommend it,0.821,0.0,0.179,0.5574,Positive
Excelente,0.0,0.0,1.0,0.0,Neutral
nice,1.0,0.0,0.0,0.4215,Positive
Excellent sunscreen for everydaySPF30 is a good compromise,0.569,0.0,0.431,0.765,Positive
Dont buy products with chemical SPF for your face especially as it protects your skin chemical compounds breakdown and create free radicalsEven Neutrogena has better products like this one,0.358,0.0,0.642,0.9074,Positive
This doesnt sting my face like most other sunscreens and it doesnt leave me feeling oily and gross,0.165,0.202,0.633,-0.2076,Negative
I wore this every day in Mexico and experienced no breakouts Im extremely happy with this purchase Thank you Neutrogena,0.263,0.089,0.648,0.6478,Positive
Safe sunscreen for acne prone skin,0.367,0.0,0.633,0.4404,Positive
LOVE not greasy and excellent coverage,0.413,0.251,0.335,0.4469,Positive
Love it and it hasnt broke me out,0.521,0.0,0.479,0.7602,Positive
Great coverage for face and chest,0.451,0.0,0.549,0.6249,Positive
I bought this because I suffer with rosacea and was looking for a sunscreen that wouldnt cause breakouts this caused a flair up before the end of the day,0.0,0.127,0.873,-0.5423,Negative
Great sunscreen  I use it consistently,0.506,0.0,0.494,0.6249,Positive
Very good sunscreen,0.615,0.0,0.385,0.4927,Positive
Worked Great Didnt irritate my skin and my face didnt burn,0.417,0.0,0.583,0.753,Positive
Works well and doesnt make my oily skin greasy  Will definitely buy again  No overpowering sunscreen scent,0.229,0.105,0.667,0.3818,Positive
I will continue to purchase this product for the rest of my life,0.0,0.0,1.0,0.0,Neutral
,0.0,0.0,0.0,0.0,Neutral
Great sunscreen doesnt make you oily or breakout at all Hurts a bit if you get it in your eyes but that is to be expected Will buy again,0.083,0.067,0.85,0.128,Positive
As expected,0.0,0.0,1.0,0.0,Neutral
I break out with most sunscreen and I tried a lot of them including la Roche Posay I used it for a week and it still didnt break me out Wow,0.132,0.0,0.868,0.5859,Positive
Love it,0.808,0.0,0.192,0.6369,Positive
As a sunscreen this works amazingly well however it makes my face brake out bad and all over,0.115,0.168,0.718,-0.2748,Negative
perfect,1.0,0.0,0.0,0.5719,Positive
Good,1.0,0.0,0.0,0.4404,Positive
Not easy to spread and feels like rubbing chalk on your face Doesnt rub in easily either so you walk around with a white face,0.089,0.159,0.752,-0.2363,Negative
I have sensitive skin and when I use this sunblock my face feels like its on fire and becomes an angry red for 5  10 minutes after application While it remains true to its word that it hasnt caused any breakouts I cant use this product without physical pain So Ive abandoned this and am trying out other brands geared towards sensitive skin,0.114,0.128,0.757,-0.2444,Negative
Absorbs very quickly and completely matte No greasy or powdery residue and little scentGoes well under makeup,0.094,0.128,0.777,-0.1672,Negative
This sunscreen does not make me break out and I have very acneprone skin It feels very light on my face too and my face doesnt look like an oily mess,0.0,0.141,0.859,-0.5588,Negative
This product is a waste of money I should have trusted the previous reviews more Shortly after you apply this sunscreen it has flakes that makes you feel and look disgusting It does it regardless if I apply anything above or below the sunscreen or nothing at all Such an expensive sunscreen that I will not waste my money on again,0.048,0.138,0.814,-0.7096,Negative
Great product,0.804,0.0,0.196,0.6249,Positive
,0.0,0.0,0.0,0.0,Neutral
love this product doesnt make me break out and is not heavy like most,0.229,0.115,0.655,0.4749,Positive
No negative skin reactions Im downnn hahaha,0.267,0.437,0.296,-0.3182,Negative
Smooth stays great under make up,0.451,0.0,0.549,0.6249,Positive
I dont think its protectivesays water resistant but I think it washes offMy kids have been wearing it from 35pm and still getting burned,0.0,0.0,1.0,0.0,Neutral
I have bought this before and didnt use it a lot and recently I bought it again this time it irritated the sides of my face and caused it to peel I thought it was just me but then my wife was using it and it irritated her face too Dont know if its been made differently or if I got a bad batch I wont be buying it again,0.0,0.152,0.848,-0.8945,Negative
This sunscreen is really oil free and with a very light texture It wont leave you White like a ghost Really like it,0.347,0.082,0.571,0.7526,Positive
good,1.0,0.0,0.0,0.4404,Positive
Works as promised,0.556,0.0,0.444,0.3612,Positive
works well,0.677,0.0,0.323,0.2732,Positive
This sunscreen is great It is light and doesnt make me break out after using it,0.215,0.0,0.785,0.6249,Positive
Doesnt work I used this sunscreen to go for a walk in the bright Florida sun for 50 min My face is all burnt What on Earth is that This is extremely upsetting and I would recommend you stay away from this stuff It obviously does not do what it claims,0.1,0.063,0.837,0.2516,Positive
I should have read the ingredients before purchasing I do not like to use chemical sunscreens If you dont mind using them then this should be fine for acne prone skin,0.058,0.068,0.874,-0.0798,Negative
This sunscreen flakes so easily it looks like im exfoliating my face every time i put it on its supper unflattering and even the lightest eyebrow itch will make you look like your face has dandruff,0.202,0.0,0.798,0.7973,Positive
Nice and light sunscreen,0.483,0.0,0.517,0.4215,Positive
Love it  Super good and doesnt cause any breakouts ,0.647,0.0,0.353,0.9001,Positive
The price is low,0.0,0.412,0.588,-0.2732,Negative
clear like wear nothing Exactly what I want,0.494,0.118,0.388,0.5964,Positive
Nice and light not oily works great,0.252,0.297,0.451,-0.1265,Negative
I have never suffered from acne pimples or anything similar but guess what THIS got me like  a 13 years old going through puberty,0.202,0.0,0.798,0.6204,Positive
I think it is ok send it to my dad,0.216,0.0,0.784,0.296,Positive
I use it for running outdoors The sweat drops naturally contain the lotion from my forehead and when they get near or inside my eyes it hurts badly and induces crippling tears for half a day Far severer and longer than any other facial sun blocks i ever used,0.0,0.235,0.765,-0.891,Negative
Works great on acne prone skin,0.451,0.0,0.549,0.6249,Positive
So far so GoodTransplant Patientneed the Protection for Just driving around,0.0,0.0,1.0,0.0,Neutral
Pretty good,1.0,0.0,0.0,0.7269,Positive
I love this product so much Doesnt leave your skin looking shiny or greasy Great for acne prone skin like mine long lasting Great for wearing under makeup Wouldnt buy any other brand,0.377,0.0,0.623,0.9461,Positive
I look for three things in my sunscreen 1 Sun protection 2 No white cast and 3 Affordable The only thing good about this sunscreen is that its more affordable I wear sunscreen diligently and reapply every 2  3 hours but with this I still got a tan so the Sun protection is not as effective as it claims,0.036,0.092,0.872,-0.4554,Negative
Excelente,0.0,0.0,1.0,0.0,Neutral
Sun Block,0.0,0.744,0.256,-0.4404,Negative
Not as light or clear as Id ideally prefer but does the trick,0.247,0.087,0.667,0.34,Positive
We love that it doesnt cause us to get break outs like some other oily sign blocks,0.296,0.084,0.619,0.7003,Positive
Love it Acne free,0.789,0.0,0.211,0.8176,Positive
This has become a popular sunscreen between myself and my husband,0.237,0.0,0.763,0.4215,Positive
Rub on not sme,0.0,0.0,1.0,0.0,Neutral
It sting my eyes The whole day my eyes were uncomfortable But besides that it was Ok Looking for another sunscreen because I cannot keep using this one,0.095,0.061,0.845,0.25,Positive
Good sunscreen without making my acne worse My dermatologist recommended it,0.297,0.196,0.506,0.1531,Positive
First sunscreen Ive ever used that didnt break me out,0.0,0.0,1.0,0.0,Neutral
Product works well to block sun and protect face but the ingredients cause concern with carcinogens,0.183,0.107,0.71,0.1027,Positive
I wish Neutrogena would make a suncreen for people sensitive to avobenzone and other zone chemicals I knew I was sensitive to the zones but Neutrogena seems to be a reputable and affordable brand so I thought Id try it It doesnt go on greasy but it stings my face so makes me sweat and then my face is oily and shiny from suncreen dissolving or falling off,0.029,0.03,0.941,-0.0129,Neutral
Worst crap I have ever put on my face I broke out immediately after one use and this was the worst break out Ive had since I was teenager So bad that coworkers asked me if what was wrong with my face  I threw this stuff in the trash If you have sensitive or acne prone skin dont believe the lie on the label You will NOT have a clear face of you go anywhere near this product Awful awful awful Negative 5 stars is more accurate than 1 Amazon needs to implement a 0 star rating at least,0.017,0.307,0.676,-0.9866,Negative
Love this product  We all have very sensitive skin and it doesnt burn or make my eyes water at all,0.181,0.0,0.819,0.6369,Positive
Not too strong a scent doesnt cause any skin problems and I feel better going out knowing Im wearing it,0.124,0.232,0.644,-0.3616,Negative
came unsealed these products always have to come sealed it wasnt even in a protective plastic bag it just came in the bubble amazon package by the product itself I always check if the product has a seal but this one did not Most likely has been tampered with andor counterfeit,0.028,0.0,0.972,0.09,Positive
Not greasy Looks well,0.0,0.377,0.623,-0.2057,Negative
I have oily acne prone skin and this made me break out so so bad I returned it by far the worst sunscreen Ive used so far,0.0,0.28,0.72,-0.8732,Negative
Good,1.0,0.0,0.0,0.4404,Positive
I thought this sunscreen was better than other products and worked better until I found out the rating of this product on ewgorg This sunscreen is very poorly rated in terms of its efficiency to protect the skin from UVA and UVB and toxicity It contains a number of harmful chemicals such as oxybenzone Its funny that this product is advertised as not causing break out when it obviously contains chemicals that might cause some harmful longterm effects,0.18,0.0,0.82,0.9201,Positive
Great product Not oily or white,0.451,0.0,0.549,0.6249,Positive
Works great and less irritating that other products,0.32,0.211,0.468,0.3384,Positive
Works as represented particularly for sensitive complexions  The leastgreasy sunscreen Ive ever used  Costs more than some but worth it,0.11,0.0,0.89,0.3291,Positive
Good if youre pale not good if youre not Leaves a whitish cast on the face and I cannot use it as a woman of color,0.11,0.091,0.798,0.1265,Positive
Good,1.0,0.0,0.0,0.4404,Positive
Unfortunately I broke out all over my chin from this productFunny because its advertised as clear face Im disappointed and I wont be using it ever again,0.082,0.26,0.658,-0.6908,Negative
My all time favourite face sunscreen Not greasy at all and have good coverage  An excellente product,0.153,0.0,0.847,0.4404,Positive
This has been my favorite for three years now Doesnt break me out and it stays completely matte through out the day,0.125,0.0,0.875,0.4588,Positive
Maybe its just me but it burns my skin when I put it on my face I cant use it,0.0,0.0,1.0,0.0,Neutral
Great product,0.804,0.0,0.196,0.6249,Positive
Im a skin cancer survivor This works great on my oily complexion,0.347,0.232,0.421,0.296,Positive
I did not like this product The consistency of the sunscreen is very unlike the regular Neutrogena lotion It did its job as far as preventing sunburn but is not worth the price and is inferior to the regular lotion,0.0,0.189,0.811,-0.7314,Negative
If you have sensitive skin please dont  buy this I got a really bad rash on my face from it my face is peeling and before this my skin was good really good I always take care of my skin but this product messed up my skin,0.147,0.144,0.71,-0.2109,Negative
i like it,0.714,0.0,0.286,0.3612,Positive
Very good,0.762,0.0,0.238,0.4927,Positive
I found out it still made my face break out then I found out I was allergic to one of the ingredience and I cannot use it anymore When I read clear face I assumed it would work obviously its not as great as I thought So now I have almost a full tube that I dont know what to do with,0.046,0.096,0.858,-0.4393,Negative
Used daily on a 5 days beach vacation to Gulf Shores Never got burned on my face at all and no break out,0.0,0.099,0.901,-0.296,Negative
Not enough to moisturize dry skin sometimes it becomes flaky  dont use if you already have acne use only to prevent acne,0.05,0.0,0.95,0.0258,Neutral
Excelente,0.0,0.0,1.0,0.0,Neutral
I was looking to switch my sunscreen since my usual brand is twice the price for half the size I liked Neutrogena products in the past and thought this would be a great alternative to what I use currently It doesnt clog pores which is nice However after a day of use my face broke out in these dry red patches It completely irritated my skin,0.135,0.085,0.78,0.5584,Positive
This sunscreen did not apply well and caused white beads all over my face that had to be wiped off I do not use any other products on my face before sunscreen I went to the store and bought the same item and it did not do this Save your money,0.071,0.035,0.894,0.4471,Positive
It broke me out bad I even got a big nodule and I hardly EVER get those My skin was pretty clear for me and now Im all broken out again On top of that it made my face super oily and greasy  Would not recommend,0.198,0.198,0.603,-0.0026,Neutral
Nice,1.0,0.0,0.0,0.4215,Positive
Love it  Its the only one that doesnt cause my face to break out  Still feels a little sticky,0.198,0.0,0.802,0.6369,Positive
Translated from Spanish by Amazon,0.298,0.0,0.702,0.1779,Positive
This burned my eyes and caused extreme swelling in one of them While I was on vacation I obviously didnt apply this to my eyes but definitely do not apply this and then touch your face I believe I had an adverse reaction due to pre existing sensitivities but do be careful,0.101,0.061,0.838,0.296,Positive
I like it a lot it doesnt burn my face  I would buy this again,0.185,0.0,0.815,0.3612,Positive
Great for hypersensitive skin,0.577,0.0,0.423,0.6249,Positive
Love this,0.808,0.0,0.192,0.6369,Positive
Love Not greasy and does not leave a white paste,0.433,0.0,0.567,0.654,Positive
exactly as advertised protected on very hot sunny days with no breakouts etc,0.329,0.121,0.55,0.5829,Positive
It makes me break out,0.0,0.0,1.0,0.0,Neutral
Leaves a mega white cast,0.0,0.0,1.0,0.0,Neutral
still makes me break out  but doesnt feel greasy,0.0,0.0,1.0,0.0,Neutral
Its okay,0.655,0.0,0.345,0.2263,Positive
Chemical burns I tried to use this on my 8 years olds face she started screaming it was burning and I wiped as much off as I could with 24 hours her entire face was peeling and no she was not sunburned,0.0,0.118,0.882,-0.5859,Negative
Oily and made me break out Sits on skin funny Not a good product,0.178,0.148,0.675,0.1265,Positive
Its amazinga clearnot heavy cover on your skinwith no smellskin care is very important to me so im so glad i bought it ,0.32,0.074,0.606,0.8068,Positive
Love the texture of this stuff Doesnt make my skin greasy or breakout and love the high SPF,0.344,0.0,0.656,0.8555,Positive
Great quality very easy on skin,0.646,0.0,0.354,0.807,Positive
Good,1.0,0.0,0.0,0.4404,Positive
It burned 4 peoples faces and left red blotchy rashy marks everywhere Do not buy this,0.0,0.0,1.0,0.0,Neutral
Works well,0.677,0.0,0.323,0.2732,Positive
When it came to me the bottle was covered in sand and had been opened GROSS,0.0,0.204,0.796,-0.5904,Negative
Make sure to spot test first I am not easily allergic to chemicals but this one made me break out in a rash,0.123,0.201,0.676,-0.4541,Negative
Non greasy,0.0,0.0,1.0,0.0,Neutral
Great sun screen product not to oily good over all,0.283,0.166,0.551,0.4007,Positive
Excelente,0.0,0.0,1.0,0.0,Neutral
Endocrine disrupter contains oxybenzone,0.0,0.0,1.0,0.0,Neutral
This is the best sunscreen lotion for me  There is none better that I know about  Nothing else compares,0.186,0.106,0.708,0.4203,Positive
Does not sting in eyes does not look oily on the skin Great buy,0.24,0.0,0.76,0.6249,Positive
LOVE IT,0.808,0.0,0.192,0.6369,Positive
This product really fits my needs  the sunscreen if definitely effective,0.392,0.0,0.608,0.7003,Positive
Creates long lasting matte effect on the face This keeps oil from building up during the day,0.116,0.0,0.884,0.2732,Positive
Excellent,1.0,0.0,0.0,0.5719,Positive
Its not greasy,0.0,0.0,1.0,0.0,Neutral
I wear this everyday and my normalsensitive skin does not show any irritation,0.197,0.0,0.803,0.4023,Positive
Very light and smooth on the skin no heavy residue easy to spread Hopefully protects as well,0.413,0.091,0.496,0.7783,Positive
Great for my Oily and dry combo skin No break outs as promised Has a soft pleasing sent,0.397,0.087,0.516,0.8316,Positive
I always get neutrogena sunscreens they are light and easy to apply,0.225,0.0,0.775,0.4404,Positive
Note that the title is misleading This does not come in a pack of 3 I just got one 3oz bottle,0.0,0.137,0.863,-0.4019,Negative
Tried to use it for sunscreen but when applied caused face to burn so had to quickly wash it off Had to throw it in the trash,0.0,0.0,1.0,0.0,Neutral
While it does protect from the sun it still makes my skin break out ,0.167,0.0,0.833,0.3818,Positive
Left a white film on my face,0.0,0.0,1.0,0.0,Neutral
I dont like it It cause burning to my eyes even when I dont put any there and I feel my face is burning when I apply this,0.0,0.084,0.916,-0.2755,Negative
Great product non breakout too Wore it in Punta Cana didnt get burnt at all,0.227,0.0,0.773,0.6249,Positive
love this stuff  It doesnt make my face break out when using it,0.259,0.0,0.741,0.6369,Positive
I have oily skin but it didnt suit me did not like it,0.0,0.195,0.805,-0.395,Negative
The smell is not pleasant but its not bad either  I have been using it for  days seems to provide protection but it burns for about 30 seconds after application Will provide update soon,0.103,0.051,0.846,0.4449,Positive
Love it mate finish,0.583,0.0,0.417,0.6369,Positive
it feels nice but both my children got really burned with it They are not fair skinned at all and have never gotten burned like thisThis maker has been on the news for the SPFS not being correct and I believe it,0.042,0.113,0.844,-0.4953,Negative
My go to for sunscreen,0.0,0.0,1.0,0.0,Neutral
This product made my skin SO oily I tried using a little bit less product every day but the outcome was still the same I ended up breaking out I like Neutrogena and have had success with a few of their other products But this ones a fail,0.159,0.091,0.749,0.5499,Positive
If you love yourself do not buy this Never had a reaction to something like this before Lol the bottle title is such a lie,0.322,0.0,0.678,0.8591,Positive
nice,1.0,0.0,0.0,0.4215,Positive
Only sunscreen my husband will use I prefer a mineral based product which in my mind is the only true sun block,0.118,0.122,0.759,-0.0258,Neutral
Sound is goodbut a pain to connect  You have to keep turning itBack on manually to connectSo you use it for a whiledo something elsethen want music againgotta go to it and turn it back on,0.036,0.09,0.874,-0.4588,Negative
