Review,Positive,Negative,Neutral,Compound,Sentiment
This works really well I always put it on in the morning and it keeps me from getting sun burnt at my job Been learning more and more about long term skin damage from sun exposure so this is a must have for men and women,0.05,0.067,0.882,-0.204,Negative
Ive been using this as a moisturizer and sunscreen before makeup and I really enjoy it Not too greasy for more oilyacne prone skin Wish the packaging was a bit different but otherwise its great,0.252,0.0,0.748,0.8673,Positive
Doesnt leave a film or residue Basically no odor Im prone to breakouts  and this has never caused anyDont get it into your eyes though,0.045,0.087,0.868,-0.2621,Negative
I like it because it works like a good moisturizer and sunscreen It protects my face so it doesnt get sun damaged Ive been using this brand for about 4 years and I think it is the best,0.375,0.0,0.625,0.9414,Positive
I like it but sometimes I feel like its making my skin darker,0.357,0.0,0.643,0.6124,Positive
Its not greasy and I havent had any breakouts while using it Its easy to apply and doesnt leave a white film on my skin I have a mediumtan complexion Would buy again,0.13,0.0,0.87,0.4675,Positive
This is hands down the best sunblock I have ever used Ive purchased multiple name brand facial sunscreens my favorite being Shiseido The Neutrogena is far superior than any of themMy face is extremely oily anti oil products never seem to work This sunblock makes my face matte It works perfect under makeup and doesnt become heavy at all I actually use it as a primerWhen getting in the pool this sunscreen has staying power It doesnt drip into the eyes at allIf youre contemplating if you should get it stop and just purchase it already,0.136,0.045,0.819,0.8915,Positive
As soon as you spread it you feel the unconfort in your eyes It makes you cry u til you wash it out,0.0,0.129,0.871,-0.4767,Negative
I have an oily face and easily to get break out However even when I wore a protecting mask for hours I have never get an acne from it,0.091,0.0,0.909,0.34,Positive
This sunscreen has a great level of SPF but it doesnt do it for me as a facial sunscreen I wore it every day for a couple of weeks and it definitely made my skin a little greasy It also tended to make my skin burn a little bit probably from the treatment included which is why I stopped using it before emptying the tube Perhaps this would work better for those with skin that isnt finicky but I will not be purchasing again,0.117,0.05,0.833,0.7717,Positive
I do not like the feel of most sunscreens on my face Even ones that are marketed as non greasy or oil free still leave me with a shiny face and a texture that I can feel Even the Neutrogena Ultra Sheer leaves a bit of a sheen stings my eyes a bit and has a fragrance Not this Clear Face product though It is transparent light feeling doesnt clog my pores and is water resistant The ONLY thing I wish is that it was a mineral sunscreen zinc oxide instead of a chemical one but I have tried many mineral sunscreens for the face and none have been as transparent and non oily as this one Highly recommended,0.07,0.039,0.891,0.5415,Positive
Love this sunscreen Wish it had zinc,0.58,0.0,0.42,0.7845,Positive
Was ready to pay out the ass for some name brand Asian sunscreen but Covid19 said no to international shipping This does the job well for the money and most importantly no alcohol,0.182,0.211,0.607,-0.0671,Negative
Good,1.0,0.0,0.0,0.4404,Positive
Its very light weight and feels good on my skin Makes it soft Not greasy  It dries quicklyAlso does not cause breakouts Already used it couple times Works for me,0.091,0.0,0.909,0.4404,Positive
This is a bit oilier feeling than the Biore UV Aqua sunscreen I used previously It has a white cast initially that disappears quickly It leaves my skin feeling a bit tacky and a bit shiny However it hasnt caused any skin concerns and my usual makeup layers over it great I may get the Biore next time just because it soaks into my skin a bit faster and feels nicer,0.14,0.034,0.826,0.765,Positive
Non greasy goes on just like a moisturizer no white sunscreen residue,0.182,0.161,0.657,0.0772,Positive
I mixed up the old tube with the new onemy apologies to the vendor,0.0,0.0,1.0,0.0,Neutral
It actually makes me breakout switching to a different natural sunscreen with not these ingredients,0.161,0.0,0.839,0.3612,Positive
Super lightweight while still providing a lot of protection Bought this for a hiking trip and didnt even get a touch of sun on my face,0.151,0.0,0.849,0.5994,Positive
Product is great for sensitive skin but actual tube was all covered with black magic markings ,0.145,0.0,0.855,0.3716,Positive
Ive been using it for a while and my skin has gotten so bad,0.0,0.272,0.728,-0.6696,Negative
Great price for a nice product  Its a good idea to have a different one for your face and neck than the rest of your body  I like this one,0.359,0.0,0.641,0.9062,Positive
Doesnt leave the awful gray tint on black skin which is what I was looking for It dissolves and absorbs fast not leaving a film of grease,0.136,0.0,0.864,0.3875,Positive
Doesnt leave a residue on your skin like most sunscreens Plus it doesnt clog pores Excellent everyday sunscreen,0.177,0.145,0.678,-0.09,Negative
Omg Im super happy with this productIm African American medium tone and lot of sunscreen products for the face will leave my face gray and chalky no matter of it says clear or not  but this product doesnt exact what it says comes out white goes on clear Im super happy no gray skin over here ,0.294,0.075,0.631,0.9513,Positive
It gave me allergies not easy to spread,0.0,0.256,0.744,-0.3412,Negative
Items came damaged in packaging and leaked,0.0,0.51,0.49,-0.6369,Negative
I used it twice both times I had a burning feeling upon application I do have sensitive skin I had hopes for it because it is marketed for acne prone skin,0.152,0.0,0.848,0.5106,Positive
Not really moisturizing since it leaves a mat finish but its good for protecting your skin,0.216,0.0,0.784,0.5927,Positive
I bought this to prevent breakouts not cause them Ive used it on four different trips to the beach and each time I break out in these tiny whiteheads all over my face Its crazy my skin routine has kept my face blemish free 95 of the time and the day I use this like clockwork tiny whiteheads on my forehead between my eyes on my cheeks in my nose creases on my nose and especially on my chin  It does protect from the sun and prevent burning but certainly caused other problems Ill be on the lookout for a more acnefriendly product  Im disappointed because Ive been a Neutrogena fan for years,0.113,0.106,0.781,-0.47,Negative
Love this stuff Feels great on your skin super light not heavy like regular suntan lotion I am very pale with freckles and this stuff offers great protection without breaking me out,0.367,0.048,0.585,0.945,Positive
love the fact that it is runny and easily applicable  and easy to spread  Unfortunately thoughafter using it for a while i started getting whiteheads so definitely have to wash my face properly after every day and have to scrub everynow and then,0.253,0.047,0.701,0.8908,Positive
Ive been on the search for a lightweight sunscreen that doesnt leave my face greasy or covered in a white cast I think I may have found it Absorbed quickly and seemed to provide good protection,0.119,0.0,0.881,0.4675,Positive
Pleased with thistle purchase It does the job as far as protecting your skin from the sun,0.153,0.0,0.847,0.4404,Positive
This is the only sunscreen that does not break my face out  I am careful to wash it off each night  It absorbs quickly and easily into the skin without residual feeling oily or any smellI have used just about every sunscreen out there for the face and this one beats them all  Ive tried ones that are 40 plus and this Neutrogena blows them out of the waterI do suggest though that you are careful to wash it completely off at the end of the day if you are prone to acne,0.059,0.014,0.927,0.499,Positive
I love this sunscreen It us completely weightless and left no white cast I highly recommend it for anyone looking for a lightweight SPF to go on top of a moisturizer,0.259,0.065,0.677,0.7645,Positive
I bought this product because I use retinol on some nights so my skin needed extra protection during the day This product does not cause breakouts and it prevents sun burns I love itI actually use it once a dayFor context I am 27 years old with dark skin with acne prone skin,0.107,0.0,0.893,0.6705,Positive
This one was a great sunscreen and very cheap,0.369,0.0,0.631,0.6249,Positive
Very clean Smells like sunscreen Light enough on the face Is a little tacky upon application I would not consider it moisturizing Works well on top if moisturizer,0.305,0.0,0.695,0.8251,Positive
Ill begin this by saying that I hate most sunscreens or anything oily on my face Upon application I was pleasantly surprised by the consistentcy It was very easy to rub in I wear this before running every day and it seems unphased by rain or sweat My face doesnt break out I do wash it off as soon as my run is over though and very little is needed This specific product has made its was through my sunscreen refusal Well done Neutrogena,0.113,0.072,0.815,0.4201,Positive
Works greatIs it bit a runnier than other nuetrogena sunblocks which is great for rubbing in the face so it doesnt take so long and can wear under face powder,0.128,0.0,0.872,0.6249,Positive
Nongreasy and has not caused my skin to breakout  Does still a little bit but overall relatively happy  I have used EltaMD for years but it is expensive so was looking for a good alternative for my sensitive acne prone skin and this seems to work just fine for me,0.201,0.0,0.799,0.9022,Positive
I highly recommend this version over the Neutrogena Sport Face flavor  That one gave me horrible breakouts as well as NO sun protection  I ended up with acne and a sunburn from that one  This Clear Face version provided sunburn protection AND left me with zero breakouts,0.142,0.122,0.737,0.0155,Neutral
Perfect for me Im black with oily skin and it doesnt seem to leave a white film on me You just need to rub it in correctly And the sunscreen isnt greasy its like matte,0.128,0.056,0.817,0.4094,Positive
This has been my goto facial sunscreen for yearshas a light pleasant smell isnt too thick or thin does its job and doesnt make my face break out,0.113,0.0,0.887,0.5106,Positive
Great facial sunscreen for acne prone skin personally I didnt experience any irritation from this sunscreen and I have sensitive skin I use this with Cearve hydrating cleanser in my skin care routine after moisturizer,0.256,0.0,0.744,0.8751,Positive
CosDNA approved ingredients nothing that will cause acne or irritation and GREAT sun protection i burn really easily and havent gotten burnt once all summer from using this stuff on my face and body it has also lasted surprisingly long despite using it for 2 12 months and letting friendsfamily borrow some,0.206,0.054,0.74,0.8491,Positive
Very nice easy to spread and smells good Very lightweight,0.567,0.0,0.433,0.847,Positive
Works great easy to apply not greasy  and it did not cause any break out or reaction on my sensitive skin Would buy again,0.241,0.0,0.759,0.7906,Positive
Peels off when putting makeup on top of it but overall works well,0.269,0.0,0.731,0.4678,Positive
Great sun tan lotion for everyday use I was Recommended this by a friend and will continue to buy as I run out,0.349,0.0,0.651,0.8442,Positive
I love this product  I have sensitive skin and this protects me very well and doesnt give me a rash  Im so happy,0.508,0.0,0.492,0.9379,Positive
My favorite sunscreen Doesnt make me break out Feels smooth on my skin,0.2,0.0,0.8,0.4588,Positive
If I use this daily I get breakouts so I only use it when I know Im going to be outside for a while It also makes my skin get oily but I never got sunburned while using this,0.0,0.0,1.0,0.0,Neutral
I have combination skin semi oily and semi dry I have acnes but my skin also feels super dry after wash etc Past sunscreens felt way to thick and heavy so I never wore on but this one feels so light and moisturizing it literally feels like Im just putting on lotion,0.155,0.0,0.845,0.8625,Positive
It appeared to be fine but I took away two stars because there was no seal as if the product has been opened,0.058,0.116,0.826,-0.34,Negative
Good stuff Do not irritate my sensitive skin,0.466,0.0,0.534,0.6407,Positive
This product is perfect for my aging skin and works wonders on my teens acne prone skin It can be used alone as a moisturizer or over your favorite Either way it doesnt feel heavy and spreads easily Plus its the only sunscreen that doesnt run in my eyes and sting them,0.157,0.034,0.809,0.7964,Positive
Best face sunscreen Ive ever used so far Went on extremely well and love how its absorbed and doesnt leave my face looking chalky Loved it,0.434,0.0,0.566,0.9442,Positive
what i love about it is1 doesnt leave white cast and make me look like a ghost2 water resistant3 fast absorbing4 doesnt clog pores and cause break outwhat i dont like is it makes my face look oily and shiny but its not a big deal because it doesnt actually make my skin oily just looks a bit shiny,0.125,0.0,0.875,0.6339,Positive
There is a slight resistance to spread but I love that its not sticky And doesnt show up white on my chocolate skin,0.225,0.0,0.775,0.7783,Positive
It makes me feel oily but it works great I used to have really bad cystic acne and I was paranoid of the UV rays causing them to leave darker marks hyperpigmentation so if Im expecting to be outdoors for long periods of time I use thisThis does not work well under make up for me make up easily melts off I use both powder and liquid foundation and sometimes BB cream,0.107,0.137,0.756,-0.1181,Negative
I have very sensitive skin and most face products make me break out  but not this one  I have never gotten burnt and never breakout after wearing  I even wear it when exercising and it doesnt run and get into my eyes and cause burning which others have done,0.0,0.0,1.0,0.0,Neutral
Translated from Spanish by Amazon,0.298,0.0,0.702,0.1779,Positive
Moisturizing without being greasy,0.0,0.0,1.0,0.0,Neutral
Translated from Spanish by Amazon,0.298,0.0,0.702,0.1779,Positive
FINALLY I break out ALL the time from oily lotions and sunscreens and this one doesnt do that to me  YESSSSS  I will say it does sting when it drips into your eyes from sweat but I can deal with that because getting big fat zits is way worse,0.0,0.084,0.916,-0.631,Negative
Great coverage I wear it everyday but I am a woman of a deepdark complexion and the product can leave a bit of a blue sunscreen tint However its great for everyday use Dont forget to reapply,0.265,0.034,0.701,0.872,Positive
Ive tried a lot of sunscreens I can actually stand this one As Im getting ready in the morning I add about two pea size amount to my face wait a couple of minutes and apply my make up as normal I havent tried it in water yet but summer is around the corner Ill update then,0.032,0.067,0.902,-0.4497,Negative
Good product I really like neutrogena but its not good for sport or if you swear a lot Its goes to your eyes and its terrible,0.122,0.273,0.605,-0.692,Negative
Ive used this for a couple years now and it works great Its a tiny bit greasy but not nearly as bad as some other face sunscreens Ive slathered it on multiple times over the course of the day and barely break out I recommend it,0.187,0.0,0.813,0.8473,Positive
Non greasy and very moisturizing,0.0,0.0,1.0,0.0,Neutral
This formula soaks right in is not oily and leaves skin ready for makeup with a matte finish Im so glad I got it,0.241,0.0,0.759,0.7481,Positive
I specifically chose this sunscreen due to its oilfree  mattifying effects and have been very pleased with the resultsI have oily skin which gets EXTRA oily in the summer especially after running outsidegetting sun and this sunscreen has helped combat the youcouldfryaneggonmyforehead look that I tend to get when its hot out I love that it has 30 SPF to protect against wrinkles and sun damage as wellI will be purchasing this item again once I run out,0.118,0.066,0.816,0.659,Positive
It smells nice and doesnt feel thick on the skin  I can wear it daily without feeling sticky Would recommend for daily skin protection,0.199,0.051,0.75,0.6033,Positive
I have found that this product works particularly well with my acneprone skin Im super pale and I lived in Santiago Chile for a few years I used this daily on my face and I think it really helped protect me from sundamage with the really intense sun exposure It doesnt break out my skin goes on easily and doesnt make my skin greasy Im pretty sure thats all one can really ask of a face sunblock,0.226,0.0,0.774,0.9491,Positive
I love this sunscreen My skin is cne prone skin i hve used many expensive sunscreen product and they are mot that good cause my face to break out This Neutrogena sunscreen is the BEST suncreen I have used so far not causing any breakout I recommend this to whoever need a suncreen that good for acne skin,0.266,0.0,0.734,0.9547,Positive
Not nearly as greasy as most sunscreens This one I can actually tolerate wearing so hats off to Neutrogena for that one I took away a star because it did seem to increase blackheads for me but hey Black heads are better than skin cancer,0.109,0.121,0.771,-0.3818,Negative
This is my favorite face sunscreen because it doesnt make me break out Havent tried anything else because theres no need this definitely does the job,0.184,0.071,0.744,0.5423,Positive
It leaves a little white residue on my face thats noticeable only from close up Otherwise it does its job,0.0,0.0,1.0,0.0,Neutral
Neutrogena Clear Face Sunblock Lotion offered a variety of benefits1 The lotion went on smooth and rubbed in quickly2 The smell was not overwhelming and the consistency was slightly watery3 When I got product in my eyes it did not burn with a voracity as other such productsCertain shortcomings included1 Difficulty rubbing the product into my beard2 Noticed the occurrence of more acne than when I use a similar Cetaphil product3 I cannot let the lotion sit on my face and pretend I am a ghostIn all I would recommend this product however I will continue to purchase the comparable version of the Cetaphil lotion and sunscreen for my UV protection needs,0.048,0.036,0.917,0.3182,Positive
Ive used tons of different sunscreens on my sensitive oily acne prone skin and all have made me break out This one has by far been the best Yes I do get some little bumps from it occasionally but its nowhere near as bad as others I just have difficult skinIt does cause my skin to get shiny and slick in the humidity but Ive never found a sunscreen that doesnt,0.109,0.043,0.848,0.6092,Positive
This lotion prevented some nasty sunburns on my face in the summer but I found that this sunscreen bothers my skin In the first hour after applying my face began to sting and turn slightly red Though it eventually goes away I did not want to run the risk of damaging my skin so I discontinued useThis has just been my personal experience Your experience may not be the same as mine because everyones skin needs are different It didnt work out for me but the product did do its job so I will give it a fairly warm review Just remember to ALWAYS patch test your skin products,0.03,0.114,0.856,-0.8602,Negative
Im a melanoma survivor I use this from head to toe not just in my face I reapply every couple of hours when Im in the sun I only get burned where I forget to apply it which is usually on the back of my neckmy fault not the products  I love this product,0.046,0.146,0.808,-0.6671,Negative
I used to believe I had a hormonal problem until I went to a dermatologist who told me I have a very sensitive skin I am born and raised in NYC my skin is always exposed to pollution After spending thousands of dollars my dermatologist recommended I stop using everything all together and stick with this productonly I was told to give it six weeks and on the sixth week miracle happened I trust this product fully and went on to recommend it to others who has acne problems Im going for a chemical peeling now that my skin has been acne controlled for the past six months to rid of my scars,0.101,0.079,0.821,0.5423,Positive
Translated from Spanish by Amazon,0.298,0.0,0.702,0.1779,Positive
I just got it in the mail todayIm not sure but isnt there supposed to be a seal under the cap Mine came in already opened But it had shrink wrap on the whole bottle,0.0,0.044,0.956,-0.1232,Negative
Awesome finish Love this sunscreen,0.735,0.0,0.265,0.8519,Positive
My favorite part of the product is that it doesnt smell like sunscreen I use it after washing my face and putting on a vitamin C serum It doesnt make my acne more red or my skin oily It also hasnt caused any acne on my acne prone skin It absorbs almost instantly and is a great base for makeup I love this product and will repurchase,0.186,0.029,0.785,0.9079,Positive
Everyone should be using this everyday  It is your best defense from the sun  Leaves a nice dry finish and I get full spectrum blockageUPDATE Downloaded Yuka and found out this has very harmful ingredients  Discontinued use,0.21,0.0,0.79,0.8176,Positive
I expected a liquid lotion to be thinner than this but it feels quite thick Otherwise feels fine not too oily and does well under make up,0.174,0.0,0.826,0.5927,Positive
I was motivated to try this sunscreen after being so tired of the pasty white film and increased acne I consistently experienced with even the Neutrogena Face formulation  I read a review of this sunscreen written by an African American woman who said she was so happy to not look like the character Data from Star Trek  Another woman wrote that this was the only sunscreen that didnt worsen her already severe acne  I can attest to both of those reviewers being correctthis is the best sunscreen I have ever used  Any pastiness in my current complexion now is all my ownbecause the sunscreen is effective,0.166,0.071,0.763,0.908,Positive
The best sun protection I ever bought I have greasy skin and acne and this product is helping me with both,0.274,0.0,0.726,0.7506,Positive
This is the only sunscreen I use on my face Ive even tried other Neutrogena products and those seem to crumble and leave weird residue This stuff goes on smoothly a little goes a long way doesnt clog my pores perfect for my oily face and protects me from the sun all day long Ive used it for years and would never switch,0.092,0.045,0.863,0.6249,Positive
I love this sunblock I dont have to worry about any breakouts,0.452,0.0,0.548,0.7654,Positive
Best sun block ever And the only one I will put on my face Its NOT the thick pasty stuff that never comes off Neutrogena Clear Face Liquid Lotion Sunscreen goes on smooth and I reapply every two hours or so  NO sunburn My face feels natural and I love this stuff Highest recommendation,0.207,0.103,0.69,0.7794,Positive
It was perfect,0.649,0.0,0.351,0.5719,Positive
Excellent product it is easily absorbed and hydrates the skin,0.433,0.0,0.567,0.7269,Positive
Im on a hunt for a sunscreen for my acne prone skin this is not the one I still had breakouts from this one and it also made my face irritated a little burning It was also too drying,0.0,0.081,0.919,-0.4588,Negative
Ive been using this all summer and my face hasnt broken out at all I love it Highly recommend,0.389,0.0,0.611,0.8607,Positive
I have sensitive skin and this hasnt given me any breakouts yet I put it over my face lotion and it works great,0.17,0.0,0.83,0.6249,Positive
This sunscreen is very effective for both pale my skin and olive tonedacne prone skin my wifes Works well protecting my pale skin in the sun of Saint Lucia and also worked well at protecting my wifes face while not causing a breakoutOverall a great sunscreen thats easy on the skin so its a win Like this review,0.253,0.048,0.699,0.9192,Positive
My friends got in a heated debate over whether this is specifically a SUNSCREEN or a FACE LOTION that also has sunscreen in it after I left it out on my counter I honestly have no idea which one it is but I use it as a sunscreenmoisturizer during the summer under my makeup and its fine My skin type is normal but tends to get oilier in the summer so far no issues with this product 1010 i keep multiple in my stockpile and will be buying again ,0.072,0.051,0.877,0.2144,Positive
I received this product on 522 and began using it within a few days I am using a face cream that causes photosensitivity so I needed some good sun protection I was excited about this product until it gave me contact dermatitis Its now 712 this picture was taken today Its been WEEKS and it wont go away ,0.1,0.0,0.9,0.6771,Positive
Love this product It blended into my skin so nicely I have oily skin and this product did not cause any issues,0.295,0.0,0.705,0.8377,Positive
Good,1.0,0.0,0.0,0.4404,Positive
Translated from Spanish by Amazon,0.298,0.0,0.702,0.1779,Positive
Im obsessed with this sunscreen I had been looking for something I could layer under foundation and this is perfect Amazing matte finish I have oilyacne prone skin plus Im outside all day but my face never burns breaks out or gets shiny Plus its so cheap,0.101,0.029,0.87,0.5267,Positive
This product is in fact lightweight and it does not cause acne Im using it in conjunction with a Curology blend specially formulated for my face because they are strict about what other products you can use at the same time It does not irritate my sensitive skin does not feel too greasy and gives good sun protection,0.087,0.0,0.913,0.6407,Positive
