Review,Positive,Negative,Neutral,Compound,Sentiment
asizebase 3,0.0,0.0,1.0,0.0,Neutral
Maybelline is a tried and tested brand Love this concealer Easy to use and apply Make sure you choose the right color for your skin tone I use a brush to apply I have combination sensitive skin and have no issues with it Highly recommend,0.242,0.044,0.714,0.8748,Positive
I use these on all of my clients perfect Matte finish paired withe the loose setting powder and fit me matte pressed powders  and ofc the foundation,0.197,0.073,0.73,0.5994,Positive
Great value and it works fine,0.735,0.0,0.265,0.8074,Positive
i can never find this shade in stores and decided to order it online i actually got 2 i love these,0.208,0.0,0.792,0.6369,Positive
I love this concealer It blends well isnt heavy and doesnt irritate my sensitive skin or make me stuffy Will definitely buy again the price is a plus too,0.33,0.0,0.67,0.8842,Positive
It has light to medium coverage at most and I find that it oxidizes It is easy to blend,0.146,0.0,0.854,0.4404,Positive
Ive used it for years but usually purchase at CVS or grocery store This was much cheaper than stores I hv darkness under my eyes This provides perfect coverage and moisture I also use it as base for my eye lids and upper eyes,0.106,0.053,0.841,0.5499,Positive
My favorite concealer Works great under the eyes or concealing blemishes,0.441,0.0,0.559,0.7964,Positive
Easy to use Blends really well Doesnt feel cheap For everyday noncakey coverage,0.325,0.0,0.675,0.6478,Positive
Works best for me,0.583,0.0,0.417,0.6369,Positive
I like the way that it easily applies to your face and blends in as you do the coverage to your face,0.205,0.0,0.795,0.5994,Positive
I liked the moisturizing effect and how it covers,0.286,0.0,0.714,0.4215,Positive
Im a little annoyed with this product Ive used this concealer for years  its a great product However I ordered the color associated with shade 10 because Ive always used shade 10 If you look at the advertised picture of shade 10 it shows 10 light but the REAL shade 10 is fair I didnt realize this until I received the product I ordered shade 10 light but what I received is shade 15 light Maybe this is partially my fault  I should have went by the shade name instead of the shade number but I assumed ordering by the shade number would bring me the accurate product I can and will reorder the right color just be aware of the flip flop of these 2 shades when ordering this product,0.065,0.064,0.871,-0.2272,Negative
This is not great for dark spots I had to reapply a few times to get light coverage But it does go on smooth and blends well,0.095,0.077,0.827,0.1288,Positive
I was scared of the shade match but it matched me perfectly Im between  shades1113 depending on the weather for sephora collection concealers The coverage and finish is great It covers my dark circles and blemishes well It lasts all day too,0.266,0.037,0.697,0.9343,Positive
very light weight in the skin blends in really easily and looks amazing,0.371,0.0,0.629,0.7574,Positive
This is so beautiful foundation because after wear its looks like very natural ,0.507,0.0,0.493,0.883,Positive
Isnt drying or patchy Applies and dries down really nicely and doesnt turn orange Will be buying again,0.158,0.0,0.842,0.4927,Positive
Best cheap concealer that I have found The colors go a little lighter than expected for me,0.231,0.0,0.769,0.6369,Positive
Nice product Matches my complexion and does the job for the price,0.203,0.0,0.797,0.4215,Positive
Ill look for a more full coverage one but it matches me perfectly I use Maybelline foundation in 336,0.256,0.084,0.661,0.7096,Positive
Easy to use and a good choice of colors,0.492,0.0,0.508,0.7003,Positive
Its a great product except it arrived with the top completely shattered,0.341,0.196,0.463,0.3626,Positive
I apply concealer under my eyes every single day I cant justify buying high end so often so I was so glad to find this a few years ago It blends wonderfully non drying and easy to find at any drugstore now I buy off Amazon Give it a try,0.241,0.0,0.759,0.9135,Positive
This is my favorite concealer So lightweight and easy to blend It does not easily crease and it will take me months before I need another because a little goes a long way with this product Does not give the heavy greasy feel on my skin,0.128,0.042,0.83,0.6283,Positive
Works great dont even need foundation anymore,0.406,0.0,0.594,0.6249,Positive
Price was good Plan to purchase again,0.326,0.0,0.674,0.4404,Positive
its pretty good,0.859,0.0,0.141,0.7269,Positive
This is a pretty good concealer but it isnt going to be mistaken for a high end product if you look closely  The concealer works best if you have moisturized skin primer on and no wrinkles  If you put in on dry skin or on crows feet it will bring attention to them not hide themI use this under my eyes with lots of primer base and it lasts a good 8 hours  I also use this on some redness or blemishes and it works fine  For the price Id say that this is 2 to my 1 Elfs Camo Concealer  Still a good item to have in your workplace makeup bag for quick spot retouches,0.17,0.048,0.782,0.938,Positive
Usually when I get concealer it never works out Either it doesnt blend it looks bad and dry or its just not my shadecolor This one was pretty good I general bought it because I couldnt find any that fit me and I was going to use it for SFX things if it didnt work I now use it for my everyday makeup ,0.13,0.053,0.817,0.6249,Positive
If I were to apply only one beauty product before leaving the house it would be concealer  My undereyes and my eyelids are so prone to dark shadowyness that I swear it looks like I have a penchant for punching myself in the face as part of my morning routine  If I want to run down the street in the morning to grab a coffee I either need to put on concealer or wear sunglasses or I fear that small children will run away from me screaming in terror convinced that they just saw a real life zombie coming out of their local StarbucksAs a result of my unrelenting dark circles concealer and I have a very intimate relationship  I swear that I have tried EVERY concealer and eye brightener that any magazine beauty blog or friend has ever recommended  YSL Touche Eclat Laura Mercier Secret Camouflage Lancome Effacernes Benefit Boiing Smashbox Photo Op Bobbi Brown Clinique Tarteokay Im going to stop naming concealers Ive tried because this is actually getting really depressing and kind of shameful  The point is out of ALL of the concealers Ive tried this Maybelline one is my favoriteI realize that my dedication to this concealer out of all the concealers in the world is kind of weird and random but I freaking love this product and Ive been using it for years now  Actually I take that back  I kind of hate this product  I would love to not be shackled to my drugaddictlike attachment to concealer  And no it doesnt work miracles my eye circles are still the bane of my facial existence  Yes I know my life is SO hard  But regardless this concealer is the best one Ive gotSometimes Ill get curious and try something else but I always come back to this  Its not too sheer but not too thick its not sticky and it doesnt crease especially not if I set it with a tiny bit of Make Up For Ever HD Microfinish Powder  This concealer comes in many different shades sometimes I go lighter or darker based on the time of year or mix a pinkbased hue with a yellowbased hue  It lasts a really long time its inexpensive especially if you buy it online and it doesnt irritate my usuallysensitive skinThe wand applicator is great  Ive found that most concealers that have a similar consistency to this one are packaged so that you have to click a button or knob on a penlike contraption in order to dispense more of the product and then oftentimes too much concealer blobs out at once and you end up wasting it which is especially annoying when you are dealing with a very expensive concealerSeveral of my friends have started using this concealer based on my rave reviews and this is probably also a good indication that my dark circles do in fact look far less horrifying once I have applied this product,0.113,0.088,0.799,0.9462,Positive
Maybelline has good quality products,0.42,0.0,0.58,0.4404,Positive
It looks very natural and the  price is  reasonable,0.259,0.0,0.741,0.4201,Positive
This is a pretty creamy moist concealer I like it quite a bit Its supposed to be a good dupe for Nars Radiant Creamy but thats out of my budget so I can only go by rumors It may be a bit creasy if you have a lot of undereye linesThe image attached shows a dot of Maybelline foundation Dream Urban Cover in the shade 115 Ivory It is surrounded by five dots of different Maybelline concealers five shades from four different linesSS is Super Stay in 10 Fair Its a little darkerashier than Fit Me and Instant Age Rewind in Fair Ill probably be testing 05 Ivory nextMC is Master Conceal in 10 Fair Its considerably lighterbrighter than Fit Me and Instant Age Rewind in Fair Ill probably be trying 20 Light nextBoth FMs are Fit Me FMF is Fit Me in 10 Fair and FML is Fit Me in 15 Light The former is a pretty good match for Instant Age Rewind in Fair and the latter is pretty close to the 115 Ivory foundation they were even closer afer drydown For other 115 foundation folks out there Fair is good for undereyes and Light is good for blemishesSide note the shade numbers on Fit Me Fair and Light were flipped at the initial release and possibly in some countries now they used to be 10 Light and 15 Fair Fair is lighter than Light so it now has a lower shade number as is the standard for Maybelline Keep that in mind when perusing swatches online Sometimes 10 and 15 are switched but Fair is always paler and cooler than LightIAR is Instant Age Rewind in 110 Fair It was still a little wet and heaped up at the time of the photo but dried down to be a pretty good match to the Fit Me FairHope this is helpful to any other paleskinned folks shopping for shades online,0.27,0.031,0.699,0.9981,Positive
Do not miss this,0.325,0.0,0.675,0.1139,Positive
Appears to be a little thick and takes a bit to spread  Coverage is great,0.255,0.0,0.745,0.6249,Positive
This stuff is pretty weak Also there is very little product in this tube I couldnt believe how quickly I ran out This stuff works best if it goes on skin first This may be weird but I prefer to put my concealerbrightener on last but before finish powder I have no problem with the other brand I had been using the one that you twist tube and it has a sponge on top I intend to go back to using that one The only plus side to this product for me was that the brush allowed me to put product in tighter places like the corners of the eyes I also did not care for the thickness of this product,0.08,0.103,0.817,-0.4482,Negative
This concealer spreads easily and does not dry out the skin  It is a bargain,0.259,0.0,0.741,0.4939,Positive
Right coverage,0.0,0.0,1.0,0.0,Neutral
Really live it for under my eyes to brighten it up ,0.225,0.0,0.775,0.4404,Positive
Excelente producto,0.0,0.0,1.0,0.0,Neutral
This product works very well for its price I have struggled with undereye bags for all of my life and I decided to buy concealer to hide them a bit I find that sometimes it takes two coats to fully cover up a blemish or eye bags but one coat will usually do the trick Very satisfied with my purchase,0.097,0.072,0.831,0.5402,Positive
It works great but theres just not really a lot of it  I can see me maybe only getting to use this at most 6 times before its all used up  This is however great for covering a quick blemish that comes up while out and about,0.167,0.0,0.833,0.8481,Positive
I ordered wrong color returned,0.0,0.508,0.492,-0.4767,Negative
My wife has been using this a few weeks and loves it  It goes on well and provides good coverage  It isnt too thin and you can do multiple layers  It blends well and the color matches her skin  It covers well and stays on for the entire day  It is available at a good price as well  If she is happy then I am happy  She looks gorgeous with and without makeup,0.328,0.0,0.672,0.9805,Positive
I got the light shade and its darker than expected It doesnt cover very well Ok for the price,0.121,0.099,0.78,0.1148,Positive
This is what I use for a natural look It goes on smooth and covers my dark under eye well It also sets really well,0.251,0.0,0.749,0.6908,Positive
Report abuse,0.0,0.808,0.192,-0.6369,Negative
Its nothing special not bad but not great either Doesnt last very long but for the price point its ok,0.105,0.292,0.603,-0.6065,Negative
good,1.0,0.0,0.0,0.4404,Positive
Very light cover,0.0,0.0,1.0,0.0,Neutral
always a good affordable medium to full coverage and not too drying or oily,0.195,0.0,0.805,0.4404,Positive
Use all over face as a baseUse various powders and blushNever disappoints,0.0,0.206,0.794,-0.3818,Negative
This is my goto concealer because its very cheap and overall okay It gets the job done and covers up well The first time I bought it Im not sure why but it would always be burning my face and I still could never figure out why It would be stinging and hurting me a lot I ordered this again recently and it doesnt burn or sting my face anymore Maybe the first product I got was expired or just had the wrong chemicals Not sure why But buyers should be careful I think overall it blends nicely in and covers up my dark circles well but it can make my under eyes look grey which might be because of how dull certain areas of my face just are The concealer itself I wish it had more product but I rarely ever wear makeup so it lasted for like two years or so Its small and carryable The color goes well with my face and it makes me look younger and less tired It really brightens my look up,0.142,0.092,0.766,0.7848,Positive
Love this product It covers everything it needs to,0.344,0.0,0.656,0.6369,Positive
This concealer dries in to your skin and doesnt leave an oily residue This means your mascara wont smear the first time you blink I use it on top of my foundation and love the way it blends Although I wish the cover up lasted a little longer I am a huge fan,0.284,0.0,0.716,0.9231,Positive
Used it couple times seems a bit cakey,0.0,0.0,1.0,0.0,Neutral
it was so good it very moisturizing to the skin,0.294,0.0,0.706,0.5777,Positive
Cover great,0.804,0.0,0.196,0.6249,Positive
Put some on the right and a little goes a long way it is super cheap and stays on all day especially with its my fit me translucent powder ,0.204,0.0,0.796,0.7506,Positive
Not terrible small tube But its more pink than I expected Works to cover dark circles to an extent,0.095,0.0,0.905,0.1967,Positive
Goes on smoothly and matchs some what but it works not to shabby,0.0,0.0,1.0,0.0,Neutral
I used to purchase Nars concealer in shade Chantilly until I discovered this Maybelline dupe I have a very sensitive and acne prone skin but I checked all the ingredients on multiple websites prior to buying it and they are all clean It is a noncomedogenic light and moisturizing concealer with sheer coverage Its honestly amazing for the price and I love it Looks very natural on the skin,0.278,0.022,0.7,0.9735,Positive
Nice but it does not look smooth on skin,0.192,0.0,0.808,0.2263,Positive
Covers problem areas well but the formula is a bit tacky and doesnt seem to blend well,0.22,0.097,0.682,0.3291,Positive
Its good enough for the price point,0.326,0.0,0.674,0.4404,Positive
I dont review often but this came earlier than expected I also received an extra one Thank you so much I am so surprised at how much the color perfectly matched my skin I bought the Honey shade ,0.284,0.0,0.716,0.923,Positive
The color I got was a little too dark for me I like a white undereye concealer But it works great and looks very natural Definitely needs a setting powder to avoid creasing but overall works great and covers blemishes as well,0.416,0.05,0.534,0.9704,Positive
This concealer is very nice Its lightweight medium coverage and lasts well However Im not entirely convinced that its authentic The silkscreening on the 2 I purchased was not exactly the same and the weight of the plastic used is susI dont actually mind considering cost and for the fact that its overall a nice product Just something to keep in mind,0.126,0.038,0.836,0.7014,Positive
this concealer is really good and cheap only bad thing is its very little product but other than that i like this concealer a lot and i recommended,0.245,0.073,0.682,0.6482,Positive
I love this product I use it everyday its good,0.542,0.0,0.458,0.7964,Positive
I love this concealer It matches my complexion its conceals perfectly and it blends well It just doesnt last that long If I put it on in the morning about 9am it wears off by lunchtime About 12pm,0.241,0.0,0.759,0.8885,Positive
I like this as a back up only to nyx,0.263,0.0,0.737,0.3612,Positive
Its for people who arent trying to cover much so youd probably have to apply a lot more if youre trying to cover dark circles Also consider the fact that the tube is small But the color is great and with some setting powder youll be okay Lol,0.21,0.0,0.79,0.9136,Positive
I have oily combo skin My dark circles arent bad but they are discolored since I dont get as much sleep as I need This concealer works great on top of a silicone based primer I use Supergoop Unseen Sunscreen as a primersunscreen I made the mistake of applying this concealer on top of my skin without primer  it was not compatible with my skin type it started dragging and not blending well  sinking into my fine lines So if you have similar skin type as I do use a primer I just put a dot or two under my eyes  blend with a concealer brush  its great,0.175,0.047,0.778,0.9383,Positive
nice if your not looking for high coverage,0.286,0.0,0.714,0.4215,Positive
its very cool and is nice,0.574,0.0,0.426,0.659,Positive
I got this to brighten up under my eyes but found I could also dab a little on two imperfections on one of my cheeks and temple  Age spots I guess I dont apply all over the face foundation unless I am going out in the evening but when I did the imperfections were covered even better by using this under it Its light and creamy and easy to spread and blend  No flaking Does not dry out the skin I have dry skin This is perfect for a gentle concealer when you dont want to apply foundation and even better if you use it under your foundation,0.191,0.035,0.774,0.9651,Positive
Most likely will not use as much,0.0,0.0,1.0,0.0,Neutral
Great coverage I havent worn it outside for a full day yet but Im excited to see how long it lasts It goes on softly and I only need a little for great enough coverage for my dark under eyes I like this a lot more than what I was using previously,0.28,0.0,0.72,0.939,Positive
I loved the fit me foundation so I wanted to try this and omg Its perfect Really light and easy to blend Soft and there was 2 that came in Definitely worth it,0.427,0.0,0.573,0.9506,Positive
super good really like,0.906,0.0,0.094,0.8622,Positive
Great concealer Works well,0.756,0.0,0.244,0.7351,Positive
Gives great coverage,0.672,0.0,0.328,0.6249,Positive
I wasnt married to any specific brand for anything specific so tried BoxyCharm subscription box to try new things I love their service and their makeup was good but even after trying so many expensive brands I wasnt sold on a concealerAfter doing too much research I quit and ordered a cheap one from Amazon until I made up my mind on which to order Welp my journey stops here For the price there isnt a ton of liquid in container so order many or save to order more later This stuff is amazing It looks completely natural and blends my dark spots better than anything Def order,0.201,0.016,0.783,0.971,Positive
A friend recommended me this product as a drug store brand with high end results Im so glad I tried it Its such an affordable price and covers my blemishes so easily,0.324,0.0,0.676,0.8997,Positive
good for beginners  ,0.592,0.0,0.408,0.4404,Positive
The concealer itself is fine However it lasted me less than a month Theres practically no product At least it was cheap,0.078,0.096,0.826,-0.1027,Negative
Ive bought the same item before a few months ago and if I remember correctly it did have a seal and wasnt opened This one was and makes me feel hesitant to use on my skinface,0.0,0.059,0.941,-0.25,Negative
i would say this a light to medium coverage but its light and it doesnt crease under my eyes,0.0,0.0,1.0,0.0,Neutral
Been using this along with the fit me pressed powder for about 5 years now and they are my absolute favorite Also arrived super quick and in good packaging,0.339,0.0,0.661,0.9062,Positive
Its difficult to but makeup online without knowing how the color actually looks Its inexpensive so its with the risk I bought one that was too dark based upon the recommended number paired with my concealer So I bought another one and it was too light It was my fault because the shade I needed wouldnt be delivered in time Either way I still use them They work great and get the job done,0.114,0.098,0.788,0.3291,Positive
I use it everyday,0.0,0.0,1.0,0.0,Neutral
I bought this because I wanted something to cover undereye circles that also had SPF I used to use Neutrogenas formula that was specifically made for this issue and it worked great but something is off about their colors is off now This product didnt cover much of anything and stung my eyes to boot Not impressed,0.044,0.058,0.898,-0.1977,Negative
Great product with good coverage but not too heavy I wouldnt say it is very sheer or moisturizing but it works great to cover problem areas or dark spots and as a highlighter,0.249,0.087,0.663,0.765,Positive
Decent concealer I do have to use two layers of it but its fine enough,0.145,0.0,0.855,0.296,Positive
Many more colors are actually available from the manufacturer than you can order here No color chart Had to buy 3 and mix them to get a good color Stays on well though Worth the 3,0.181,0.058,0.761,0.5719,Positive
I was never one to need to wear makeup but now that im older there are just a few pigmentation spots that could be balanced out making it blend into my natural skin color and boy is this the answer I also wear glasses and have the annoying marks on the bridge of my nose so when i switch to my contacts i like to conceal those darker marks too I am very pleased with my purchase,0.133,0.044,0.824,0.8042,Positive
Great price Cheaper than in stores,0.451,0.0,0.549,0.6249,Positive
Use this daily to hide my dark circles,0.0,0.195,0.805,-0.1779,Negative
I put it on and forget about having anything on my face  Great product,0.241,0.112,0.647,0.4939,Positive
Ive used this many times before I dont know if they changed the consistency but it burned my under eyes,0.0,0.0,1.0,0.0,Neutral
This is a very nice match in the Fit me line It is very creamy and smooth I was very pleased with my purchase if this and will deff be buying this again in the future If you buy the same number as the foundation it matches perfectly And if you go a slight shade lighter it is beautiful for a enhancer for the eye areaI have been using the Maybelline brand for at least the past 89 years and I dont plan on switching Fingers crossed that they dont make and changes on their end But the Fit me matte it perfect if your face is a bit on the oily side And I have an issue with that by the end of the day And this foundation is excellent at controlling that If you use a really good moisturizer to set your face off and allow it to dry to tacky and then add a very good primer on top of that And let that set to bake a bit As you hunt for something to wear And then apply your foundation And then whatever eyeshadows mascaras liners brows etc  you are going to wear And then use a good primer to set all of it You will be good for the day Sure you could use whatever foundation and set it with a primer But it all plays hand in hand If one is bad then it knocks it all out of whack You have to use a good base and set it right And this foundation gives you a very good base,0.229,0.016,0.755,0.9963,Positive
It did well,0.512,0.0,0.488,0.2732,Positive
As described  Works well under eyes to brighten those dark bags,0.357,0.0,0.643,0.6124,Positive
I ordered one and I received two like an amazing deal Bess under eye cover up I have purchased,0.31,0.0,0.69,0.743,Positive
This is my everyday use to go choice I love this product so much Good price and coverage Cant complain,0.372,0.0,0.628,0.8587,Positive
BUY THIS As a 36 year old mom of two I am always tired af and trying to hide itTHIS IS IT Just as good as the 20 I was spending in SephoraUlta but a fraction of the cost and shipped to my house,0.046,0.078,0.876,-0.09,Negative
Translated from Spanish by Amazon,0.298,0.0,0.702,0.1779,Positive
The coverage for this concealer is AMAZING I was blown away at how well it covered my hereditary dark circles I love makeup but for a quick day to day I just stick with concealer to brighten up my under eye I usually buy more expensive brands for good coverage but Im allergic to the fragrance in them and I kept hearing great things about the FitMe concealer I really cant say enough about how impressed I was with it and its a fraction of the price And the best part is that my eyes dont get itchy at the end of the day because there is no fragrance The only reason Im giving it 4 stars is because of how hard it is to color match for me I am fairly pale but I have yellow undertones so I ordered 15 Light because the others look too pink but its a little too dark to wear as concealer Would be a great overall color but it wont brighten under my eyes as much and so it just doesnt work Luckily they offered me a refund I will go into a store and ask for a recommendation before I buy another color but definitely plan to buy FitMe concealer again if I can color match it well,0.213,0.045,0.742,0.992,Positive
Translated from Spanish by Amazon,0.298,0.0,0.702,0.1779,Positive
