Review,Positive,Negative,Neutral,Compound,Sentiment
I have dark circles under my eyes an am constantly searching for just the right product to make them less noticeable  Although this concealer is not a perfect solution it does a good job and its reasonably priced,0.073,0.124,0.803,-0.264,Negative
Stays on well does its job,0.296,0.0,0.704,0.2732,Positive
Its has a orange undertone,0.0,0.0,1.0,0.0,Neutral
Awesome,1.0,0.0,0.0,0.6249,Positive
I have heard good things about this product and I decided to just try it It works fairly well to hide most of my imperfections,0.187,0.064,0.749,0.5106,Positive
This concealer is good Its not great at least in my case at the end of the day I seem a little cakey in the areas I applied the concealer Also it sometimes burns my skin when I apply it,0.072,0.082,0.846,-0.1012,Negative
wonderful coverage and lasts all day,0.425,0.0,0.575,0.5719,Positive
I really wanted to love this product as many people have raved about how wonderful it it The formula is great but I found that the color was VERY light and I am extremely fair skinned I had a hard time blending this out because it was lighter than even my highlighter,0.202,0.029,0.769,0.8563,Positive
Its very blue toned on me but it oxidizes and matches me alright after powdering MUCH fairer than shade 20 though they work together nicely to make a good neutral tone but they crease something terrible,0.225,0.092,0.684,0.7227,Positive
I was pleasantly surprised at how great the coverage was on this I have dark spots all over my face from three decades of blemishes It only took a small amount of product to cover my trouble areas It dried quickly and lasted all day I would definitely purchase this again,0.209,0.048,0.743,0.8442,Positive
Ordered the sand color  Much darker than description,0.0,0.0,1.0,0.0,Neutral
This product is much darker than I expected Its definitely good coverage but creases terribly on my eye lids when I use it as a base,0.132,0.171,0.697,-0.4767,Negative
It works well but it doesnt last long at all,0.147,0.0,0.853,0.1406,Positive
This item was used,0.0,0.0,1.0,0.0,Neutral
Absolutely love the pigment and silky feel,0.428,0.0,0.572,0.6697,Positive
This color has a yellow undertone which I was not expecting It is darker than the lightest shade of matching foundation which threw me off and it stings under my eyes which isnt something I normally experience I will probably not buy this again,0.0,0.0,1.0,0.0,Neutral
Didnt love the shade but it will do Amazing product for the price Some concealers tend to make my skin flaky but this doesnt Its a keeper,0.166,0.07,0.765,0.6144,Positive
One of the best drugstore concealers nice coverage not too much but enough for it to brighten Its not drying at all but it isnt oily Super recommended,0.223,0.163,0.614,0.3056,Positive
Love love love this If u r looking for a natural look this is IT No cracking up  or breaking up sooo smooth,0.467,0.068,0.464,0.9313,Positive
Great product and especially for the price,0.406,0.0,0.594,0.6249,Positive
Works well on my pale skin with neutral undertones,0.208,0.0,0.792,0.2732,Positive
This stuff is amazing Its creamy and really great to cover blemishes and under eye It blends well and the applicator makes it easy to applyOverall Im really satisfied with this concealer Definitely would repurchase again ,0.388,0.0,0.612,0.9583,Positive
Good concealer,0.744,0.0,0.256,0.4404,Positive
To clarify I have hooded lids and I usually just use concealer sticks to prime my eyes I decided to try my hand at a liquid primer since I never tried one before The ones I purchased were kind of dry and did not blend well into the color of my skin and I used a concealer brush at that It just looked like I ran a miniature paint roller over my eyelids At that point I didnt bother with shadow I just wiped it off And its not easy to get off either I guess I shouldnt have expected much from the beginning given the price Im aware that these work for some people but it most definitely did not work for me,0.08,0.027,0.893,0.7389,Positive
GOOD AT COVERING BLEMISHES  SINCE MABELINE TOOK AWAY SHINE FREETHE ORIGIONAL THIN FOUNDATION IM CONSIDERING USING THIS AS A FOUNDATION IT LEAVES MY FACE SHINY THOUGH I DONT USE MAKEUP THAT OFTEN SO THE EXTRA COST WONT BE SO BAD,0.142,0.0,0.858,0.7155,Positive
Everything is good but the color Especially it is not the right one for my dark circle The product is very good,0.225,0.0,0.775,0.7003,Positive
Works well,0.677,0.0,0.323,0.2732,Positive
This concealer is magical I use it with the liquid foundation as well as the powder and it gives my face such a matte look,0.087,0.0,0.913,0.2732,Positive
Although the Fit Me foundation made my skin itch this Fit Me concealer gave me no problems  The product was exactly the correct shade I have fair skin and application was a snap  I have since purchased another of these and would highly recommend you try it,0.19,0.092,0.717,0.6361,Positive
Its not to bad,0.487,0.0,0.513,0.431,Positive
Not sure why but it turns yellow on my skin under the eyes so I have to use less of the product and dont get the full effect I want however on pimples and such it works great,0.171,0.036,0.794,0.7663,Positive
Great for the price cant beat it,0.406,0.0,0.594,0.6249,Positive
A full coverage product,0.0,0.0,1.0,0.0,Neutral
So smooth and good coverage Doesnt crease and lasts me all day at work And I work over grills and fryers I sweat alot and Im oily Still perfect at the end of my shift,0.181,0.0,0.819,0.7823,Positive
Decent,0.0,0.0,1.0,0.0,Neutral
Love the consistency of this concealer Blends in really well easy to apply Medium was perfect for me I wear Fit Me matte foundation and the powder in 220,0.41,0.0,0.59,0.943,Positive
Great coverage and no creasing This is my go to concealer,0.268,0.144,0.588,0.4404,Positive
I first bought this in the shade medium because Im not that pale but after buying it in Fair it really covered my dark circles and gave me that highlight I wanted I now use one for concealer and the Fair for highlight Great price,0.324,0.0,0.676,0.9568,Positive
I really like this product at first it burned when I applied it but only because I forgot I was wearing an acne topical ointment my bad It is the perfect color for my skin and I love the application,0.263,0.098,0.639,0.84,Positive
Coverage is fine  Product is more yellow than I expected,0.184,0.0,0.816,0.2023,Positive
This price is WAY better than the drug store price 999  I have tried so many expensive concealers and I always come back to this one,0.112,0.0,0.888,0.4404,Positive
My favorite liquid concealer  Place a little under my eyes then spread with my finger then blend out with a brush  Works great,0.272,0.0,0.728,0.7964,Positive
Best affordable liquid concealer,0.583,0.0,0.417,0.6369,Positive
None,0.0,0.0,1.0,0.0,Neutral
Have been using it for three years now,0.0,0.0,1.0,0.0,Neutral
This is a dewy finish concealer Its medium coverage great for dry skin I use it mostly to hide dark circles under my eyes Its my favorite everyday concealer,0.216,0.052,0.732,0.7506,Positive
The quality is higher than my original expectation It is smooth to apply and does not need to apply more than once a day I am very pleased with this product,0.169,0.0,0.831,0.6697,Positive
Work very well for a drugstore product I recommend it 1010,0.411,0.0,0.589,0.5984,Positive
Does the job,0.0,0.0,1.0,0.0,Neutral
Report abuse,0.0,0.808,0.192,-0.6369,Negative
This is my fourth one Im not only using it as a concealer but also a whole  face foundation Love it,0.244,0.0,0.756,0.7783,Positive
easy to use,0.592,0.0,0.408,0.4404,Positive
Best drugstore concealer,0.677,0.0,0.323,0.6369,Positive
Best for under eye Great consistency color match and payoff,0.509,0.0,0.491,0.8519,Positive
Love it,0.808,0.0,0.192,0.6369,Positive
I wanted to love this concealer because I really do love all maybellines fit me collection but this concealer was a huge no for me It creases within minutes of wearing it even after using powder to set and setting spray I applied it how I usually apply my concealer Ive used other brands that did not crease but this isnt the one,0.151,0.043,0.807,0.7269,Positive
I opened the concealer and its all dried out like its old Im so disappointed in this product,0.116,0.186,0.698,-0.3593,Negative
The brush is similar to a lip gloss brush which makes it very easy to apply The product is lightweight enough that it doesnt look cakey but it still conceals blemishes It also blends very well,0.136,0.0,0.864,0.6353,Positive
I like it Sand is good for yellow undertones Light is better for peachy undertones Im glad they have a sand color available I like to set it in banana powder It creases some but lets be honest they all do on most of us,0.278,0.0,0.722,0.8968,Positive
Works so well Its now officially my goto concealer,0.23,0.0,0.77,0.3384,Positive
Not completely full coverage but definitely enough for every day  My favorite drug store concealer,0.367,0.0,0.633,0.8201,Positive
Works great amazing has a good price on this I replenished mine so I already knew how it performed,0.454,0.0,0.546,0.8957,Positive
Pretty good for the price Will buy it again,0.466,0.0,0.534,0.7269,Positive
Im over 35 and was worried it would sit in tiny lines but it doesnt at all feels very light and sheer yet has good full coverage I love it lasts all day even through heat and sweat from a summer day,0.2,0.033,0.767,0.8765,Positive
I bought this one because I had color 10 and I wanted something darker This one was lighter than I expected because it was lighter than my 10 I guess 10 darkened over time and since I got this 15 new it was lighter Either way it works well,0.048,0.0,0.952,0.2732,Positive
This is a GREAT concealer I use it under my eyes to bake and its very full coverage and blends easily I have purchased it multiple times and feel like stocking up prior to Maybelline discontinuing it which they always do with the best products,0.268,0.0,0.732,0.9317,Positive
Lovely concealer Medium coverage If you have wrinkles or bags under your eyes I recommend you go light on the application and set it with powder Always moisturize before putting makeup on,0.178,0.0,0.822,0.743,Positive
Love this concealer it conceals but doesnt break me out Could be cakey if overapplied,0.157,0.0,0.843,0.3818,Positive
Its a little watery for me Decent coverage,0.0,0.0,1.0,0.0,Neutral
Perfect for me havent tested it out but the shade is nice i am indian but not that dark so this medium shade is great for me,0.337,0.0,0.663,0.9136,Positive
Its too dark not as described,0.0,0.0,1.0,0.0,Neutral
Been using this for years  I love this stuff Covers my dark circles perfectly without caking over my foundation,0.344,0.0,0.656,0.8555,Positive
SOFT AND CREAMY TO USE APPLIES EASILY UNDER EYES I USE IT OVER MY FOUNDATION TO CORRECT THE COLOR SOMETIMES I HAVE A TAN AND USE THE COMPLEMENTING TAN FOUNDATION COLOR ON THEN PUT ON THE CONCEALER TO BRIGHTEN THE UNDER EYE AREA A BIT,0.12,0.0,0.88,0.6486,Positive
Liquid concealer is best for mature skin Especially under the eyes Works great,0.526,0.0,0.474,0.9022,Positive
Pretty good There are definitely better makeups out there but Im happy with the coverage and finish,0.518,0.0,0.482,0.8979,Positive
This toasty cooler blends perfect with my brown skin,0.316,0.0,0.684,0.5719,Positive
have to set it but great coverage,0.485,0.0,0.515,0.7684,Positive
I love this product and the ease from amazon just adds to how great it is The price beats any drugstore,0.439,0.0,0.561,0.91,Positive
Love this hides my dark circles,0.424,0.172,0.404,0.5423,Positive
I hardly ever wear makeup but I wanted to look more awake so I use a little of this to cover up some of the dark circles under my eyes Its perfect for my needs and it was the perfect shade Great product,0.304,0.0,0.696,0.9568,Positive
Work very well super smooth and light,0.568,0.0,0.432,0.763,Positive
works as well as the pricier products,0.259,0.0,0.741,0.2732,Positive
Not that bad,0.588,0.0,0.412,0.431,Positive
Im glad I found this This shade is not available in the Philippines The coverage is good but the formula is thin Very lightweight Will definitely buy again,0.248,0.0,0.752,0.7843,Positive
Cheap easy to apply and blend comes in a wide range of colors fits easy in a makeup bag so you can take it anywhere I use it mostly to combat redness around my nose and to line around my lips to give lipstick more definition Great product,0.19,0.045,0.765,0.8307,Positive
Very nice product Good price,0.676,0.0,0.324,0.7397,Positive
The coloring was perfect and it is so easy to put on your face without any trace  covers up those blemishes really good,0.347,0.0,0.653,0.8918,Positive
Great product that covers my dark without cracking or looking cakey the formula its light weight and easy to apply,0.28,0.0,0.72,0.7906,Positive
Received have not used but color is ok,0.286,0.0,0.714,0.4215,Positive
Good value for money Its a similar product to Nars creamy concealer,0.371,0.0,0.629,0.6486,Positive
Im mediumskinned Oriental Asian and use the 25 Medium shade It doesnt totally cover up puffy undereye bags but it does smooth my skin out nicely without looking caked on I like this a lot and use it every day The shade is perfect,0.238,0.0,0.762,0.9209,Positive
I love this concealer Im taking a break from the LA Girl ProConceal and decided to try this its creamy applied really nice and its my perfect shade,0.323,0.0,0.677,0.8999,Positive
The product came opened and the outside of the container was smeared with the product  This has caused me to be turned off by anything edible or personal care items vitamins and other things dangerous if they have been opened and returned sold by Amazon  I think the product return code should be stricter in order to protect everyones safety from product contamination,0.146,0.044,0.81,0.7351,Positive
Didnt think it would be darker shade it was described as like the medium skin color but this was darker than expected,0.077,0.0,0.923,0.1901,Positive
Liquid is very thin not much coverage if any,0.0,0.0,1.0,0.0,Neutral
Although this product works well it somehow manages to get all over everything in the concealer section of my makeup organizer  anything else that is in my makeup bag with it It has very nice coverage,0.132,0.0,0.868,0.6361,Positive
When I put this on it stings before it is blended out Doesnt matter where I use it Doesnt cover under eye well,0.095,0.048,0.857,0.2561,Positive
I bought this to use for my dark circle it works to cover it is watery liquid so you dont use aolt of it Since I did get a lil sun tan over the summer it is lighter than usual still works,0.0,0.0,1.0,0.0,Neutral
Best coverage i recommen,0.677,0.0,0.323,0.6369,Positive
One of the better concealers Ive used to date,0.266,0.0,0.734,0.4404,Positive
This concealer is ok It tends to look watery when applied But it does settle decently Id rather use a different brand,0.074,0.0,0.926,0.1531,Positive
Dont know much about this but my girlfriend loved it So recommend it,0.451,0.0,0.549,0.8761,Positive
good,1.0,0.0,0.0,0.4404,Positive
Good pigmentation covers dark circles not drying a little can go a long way good price BUT do need to set it to make it last all day,0.14,0.0,0.86,0.4404,Positive
It doesnt last long but for this price is ok Easy to apply but it just last about two hours,0.27,0.0,0.73,0.7684,Positive
For anyone saying that the color 10 light is too dark for them 15 fair is actually very paler than that shade Not sure why this is but I have both and the difference is very obvious,0.044,0.04,0.916,0.0436,Neutral
It is a bit lighter than I like but I will be able to use it  Nice feel price is right,0.254,0.0,0.746,0.6652,Positive
Doesnt cover as well as described as it did,0.0,0.185,0.815,-0.2057,Negative
Value and price there Applies easily and does the job,0.375,0.0,0.625,0.5859,Positive
I love the maybelline fit me products I use it for concealing my dark circle around my eyes,0.324,0.0,0.676,0.7717,Positive
Maybelline always hit at concealer products  This one is the best over age rewind series if you have dry skin  Blend like real smooth skin and can be used 3 or 4 months even if you use daily ,0.165,0.0,0.835,0.7717,Positive
Just like the one I buy at the store,0.263,0.0,0.737,0.3612,Positive
I have very dark circles due to my fair skin and heredity  This is the best concealer Ive found thus far  It goes on smooth and the fair color matches my skin tone well,0.273,0.0,0.727,0.872,Positive
very smooth concealer not completely full coverage as my circles are extremely dark but great product easy to apply,0.368,0.0,0.632,0.8978,Positive
I have very dark circles from being ill with Lupus and my medications  This is one of the few affordable concealers that really works and blends in well,0.07,0.094,0.836,-0.1779,Negative
I love this so much its creamy and it conceals dark areasalso gives a nice glow I recommend to set it with a little powder so it would last longer,0.292,0.0,0.708,0.8591,Positive
Its a good product though and does its work,0.293,0.0,0.707,0.4404,Positive
Cheap product Cheap quality,0.0,0.0,1.0,0.0,Neutral
The only negative thing I have to say about this is that it arrived broken but still usable Other than that I really like the product and the coverage it gives me,0.105,0.125,0.769,0.0745,Positive
I love this concealer Its not cakey or too light just right Its actually good enough for me to not have to use any foundation at all I apply to trouble spots and blend it out with my fingers I am definitely getting this one again,0.19,0.052,0.757,0.7964,Positive
Looks like someone used the product for a while before I received it Grossed out to try it,0.14,0.078,0.782,0.2732,Positive
Great stuff  Dupe for Nars concealer in vanilla and much cheaper,0.263,0.16,0.577,0.3818,Positive
Got this in the lightest shade they have  and it is still too orange  Thought this might finally be a concealer that works for my pink skin  but alas  no  it is fairly invisible on the skin with good coverage  hence the 3 stars  Just not my shade,0.074,0.104,0.822,-0.1531,Negative
doesnt stay very long but i like it better than the nars concealer which is far more expensive both this and the nars one are not long lasting though,0.224,0.0,0.776,0.8174,Positive
Good,1.0,0.0,0.0,0.4404,Positive
I mostly use this product to cut the crease when doing eye shadow Drys fast and has nice coverage,0.134,0.1,0.766,0.1779,Positive
The item was not sealed and is scratched up on the outside,0.0,0.0,1.0,0.0,Neutral
I wish it were a bit thicker,0.403,0.0,0.597,0.4019,Positive
much better than I thought coverd my acne perfect I love Maybelline fit me their products are good and affordable,0.555,0.0,0.445,0.9451,Positive
10 Light on the right and 20 Sand on the left 10 light has more warm undertones and 20 sand has more yellow undertonesCoverage is great,0.208,0.0,0.792,0.7425,Positive
My favorite all time concealer I cant find it in stores anymore so I was delighted to be able to order it online,0.257,0.0,0.743,0.7635,Positive
Great product  Easy to apply and does what it is supposed to doconceal,0.389,0.0,0.611,0.7906,Positive
Works great I typically use it in the morning just under my eyes and it seems to stay well enough through the day,0.237,0.0,0.763,0.7351,Positive
10 Fair has been my shade for a lot of years so Ive learned the exact look of it The concealer I received was labeled as 10 but was a completely different concealer that was actually closer to 15,0.045,0.0,0.955,0.1655,Positive
I use this for contouring I like the shade but only thing is the scent and small amount,0.104,0.0,0.896,0.1901,Positive
Too dry difficult to blend  too chalky looking for a concealer,0.0,0.217,0.783,-0.3612,Negative
Im yellow skin tone Matches I also mix it with my Kat von D foundation and looks great,0.215,0.0,0.785,0.6249,Positive
little dark but good,0.535,0.0,0.465,0.5353,Positive
It works still doesnt fill in lines,0.0,0.0,1.0,0.0,Neutral
I bought 4 of this products and the packages of two of them look like this as if someone tired to open it or something and one of it even looks like its not full as a brand new one So weird  not sure if I should return it,0.096,0.137,0.767,-0.2775,Negative
Good,1.0,0.0,0.0,0.4404,Positive
This is a very good undereye concealer  Pat it on gently set with powder and no touchups needed  You can pay 20 for other brands that are no better than this one  What a great price,0.287,0.126,0.587,0.8553,Positive
I was hesitant to buy concealer without seeing it in person but Ive been using this for a couple weeks and Im in love The coverage is great and its not too heavy and goes on smoothly I love that a little goes a long way and Ill definitely order again,0.315,0.079,0.606,0.9618,Positive
Had better concealers Doesnt work well on blemishes but its sort of good for bags under eyes and circles,0.235,0.062,0.703,0.6064,Positive
the concealer arrived on time well packaged have used it twice and like it,0.277,0.0,0.723,0.5574,Positive
Not the best concealer ever but certainly not the worst Not as full coverage as I would really like in a concealer though,0.369,0.072,0.559,0.8764,Positive
First time I liked the concealer Maybeline concealer is amazingconcealed my under nicely and the dark spot of acne was covered smoothly Before using this I was not satisfied with the looks after application Now I have no worries,0.129,0.167,0.704,-0.1611,Negative
This concealer goes on so well it doesnt leave dry patches or look cakey,0.245,0.0,0.755,0.4384,Positive
It seemed like there was barely any concealer even in the bottle There are many more concealers that are around the same price that you should spend your time to look into I wouldnt really recommend this,0.064,0.06,0.876,0.0447,Neutral
Always love this protect Its the best and works amazing,0.717,0.0,0.283,0.9451,Positive
Good coverage for my super dark circles  However it cakes very badly in any sort of wrinkle it can find  It actually might be making new ones just to hide in  I swear I looked older by the end of the day and might as not have been wearing makeup  I gave it one star back for blemish coverage which it is okay at not great as it also will cake in any dry skin around the pimple but covers angry red ones okay,0.09,0.123,0.787,-0.4667,Negative
I definitely think that this product is good for its price However coming from more highend concealers this formula was much more runny and caused slight irritationburning when applied It does provide coverage and is blendable and very buildable,0.135,0.0,0.865,0.6808,Positive
__ReviewTextReadMoreV2__,0.0,0.0,1.0,0.0,Neutral
I hate this concealer can never get it to come out of the tube and the few times it did it wasnt anything special,0.0,0.221,0.779,-0.7147,Negative
This is a hard no for me Im fair and cool toned and  all the shades lean orange Also I found it gloppy and the applicator is unhygienic I had to use a brush or sponge I could wash I prefer Lancme or LOral,0.109,0.085,0.806,0.25,Positive
I had a SEVERE allergic reaction to this My eyes constantly watered and burned The skin around my eyes got soooooo raw I had to buy aquaphor and coat it down for days This was my experience using this product for one week Absolutely regretted it,0.0,0.174,0.826,-0.8139,Negative
I feel like this product does not do what it says hence the low rating it gets from my sideSurprised it would even be marketed as anything agerelated as I have found it to cake and crease everywhere and just sit on top of the skin like a clay mask Maybe it looks good on camera or in photos but to me this has been unwearable because of its thickness  For the record I use Max Factor pan sticks and other thick foundations and concealers therefore it isnt the consistency that bothered me but the effect I bought two tubes and ended up tossing them both unfortunately The packaging is also unhygienic and messy a lot of product gets stuck in the sponge and this concealer is also not that cheap in Europe The shade selection is ok I guess but overall this should perhaps be marketed for younger people as opposed to anyone who wants to rewind their age,0.058,0.08,0.861,-0.6908,Negative
Color match and consistency were good but this formula burned my eye area so badly I had to wash it off immediately My skin is somewhat but not extremely sensitive and this concealer caused a strong and immediate reaction unlike any other undereye concealer Ive ever used I know its a cult favorite but for me it went into the trash after the first use,0.143,0.075,0.782,0.6011,Positive
I like this concealer quite a bit The applicator is nice the sponge makes it easy to apply and blend the concealer evenly There is a decent shade selection The sponge does seem like it will be a bacteria magnet so I use this as much as I can Never for more than a couple months max The coverage is medium and not too heavy looking,0.163,0.0,0.837,0.8658,Positive
The coverage was good but i disliked the packaging I would never buy it again,0.118,0.215,0.667,-0.3818,Negative
This is my HG concealer I am yet to find something that is so skinlike doesnt accentuate fine lines or look cakey under my eyes It is seamless,0.0,0.058,0.942,-0.1511,Negative
